"Understanding LoRaWAN Transmissions in Harsh Environments: A Measurement-Based Campaign Through Unmanned Aerial/Surface Vehicles","A. -M. Drăgulinescu; C. Zamfirescu; S. Halunga; I. Marcu; F. Y. Li; O. A. Dobre","Department of Telecommunications, National University of Science and Technology Politehnica Bucharest (UNSTPB), Bucharest, Romania; Vodafone România, Bucharest, Romania; Department of Telecommunications, National University of Science and Technology Politehnica Bucharest (UNSTPB), Bucharest, Romania; Department of Telecommunications, National University of Science and Technology Politehnica Bucharest (UNSTPB), Bucharest, Romania; Department of Information and Communication Technology, University of Agder (UiA), Grimstad, Norway; Faculty of Engineering and Applied Science, Memorial University, St. John’s, Canada",IEEE Transactions on Instrumentation and Measurement,"23 Jan 2024","2024","73","","1","14","Along with the ubiquity of various Internet of Things (IoT) applications, data collection in harsh environments with the help of unmanned aerial vehicles (UAVs) and unmanned surface vehicles (USVs) appears as a popular approach. However, from a networking and transmission perspective, how unmanned vehicles collaborate with each other and with end IoT devices as well as the propagation characteristics for such data transmissions are less exploited. In this article, we develop a long-range wide-area network (LoRaWAN)-based data collection framework which enables UAV and/or USV-assisted data acquisition in harsh environments. Within this framework, end devices are placed in hard-to-reach locations and data acquisition is performed in an on-demand manner by unmanned vehicles acting as a gateway or peer for end devices (EDs). The framework also includes a step-by-step procedure for data collection and analytics, from parameter configuration to model validation. To reveal the transmission characteristics, we identify three scenarios in a mountainous region in Romania and perform extensive real-life measurements for data collection. Based on the collected datasets, we develop four propagation models and demonstrate that our empirical models outperform the theoretical reference models. Based on the developed empirical models, the coverage of LoRaWAN for any spreading factor (SF) can be estimated with high precision.","1557-9662","","10.1109/TIM.2024.3351262","European Economic Area (EEA) Norway (NO) through the Project “A Massive MIMO Enabled IoT Platform with Networking Slicing for Beyond 5G IoV/V2X and Maritime Services (SOLID-B5G)”(grant numbers:2014-2021,42/2021,RO-NO-2019-0499); National Program for Research of the National Association of Technical Universities—GNAC ARUT 2023(grant numbers:21/2023); Ministry of Agriculture and Rural Development through Smart Viticulture Based on IoT Techniques—Premise for Climate Change Management(grant numbers:6.3.13/2023); ","https://ieeexplore.ieee.org/stamp/stamp.jsp?arnumber=10385137","Data collection framework;end devices (EDs);Internet of Things (IoT) and long-range wide-area network (LoRaWAN);measurements and validation;propagation models, unmanned aerial vehicle (UAV) and unmanned surface {vehicle (USV)}","Data collection;Data models;Autonomous aerial vehicles;Internet of Things;Data communication;Analytical models;Logic gates","","6","","32","IEEE","9 Jan 2024","","","IEEE","IEEE Journals"
"Experimental Method for the Assessment of ISO Reference Nozzles by N60 Shadowgraph","S. Amin; L. Becce; A. Ali; F. Mazzetto","Faculty of Agricultural, Environmental, Food Sciences and Technology, Free University of Bolzano-Bozen (UNIBZ), Bolzano, Italy; Competence Centre for Plant Health, Free University of Bolzano-Bozen (UNIBZ), Bolzano, Italy; Faculty of Agricultural, Environmental, Food Sciences and Technology, Free University of Bolzano-Bozen (UNIBZ), Bolzano, Italy; Competence Centre for Plant Health, Free University of Bolzano-Bozen (UNIBZ), Bolzano, Italy",2024 IEEE International Workshop on Metrology for Agriculture and Forestry (MetroAgriFor),"11 Apr 2025","2024","","","649","653","Aim of this study is identifying the relevant parameters of the five spray class boundaries, defined by ISO 25358:2018, when the respective Drop Size Distributions (DSD) are evaluated by an Oxford Lasers N60 shadowgraph. A key goal of this study is creating a database of nozzle properties. Five stainless steel flat fan nozzles (Tee Jet, USA) were chosen according to the ISO 25358 standard, which defines spray classes according to droplet size spectra from Very Fine (VF) to Ultra Coarse (UC). A hydraulic test bench was employed to replicate spraying conditions precisely under controlled settings. The nozzles were tested at three different distances from the system's field of view (0 cm, ±3.5 cm, and ±7 cm from the nozzle cone's center axis) keeping the pressure conditions as requested by the standard. As expected, the results show that the cumulative volume percentage increases as the droplet diameter increases showing a sigmoidal trend for each nozzle type. The VF/ F nozzle produced the smallest droplets, with Dv10, Dv50, and Dv90 values of $\mathbf{68.2}\ \boldsymbol{\mu} \mathbf{m}, \mathbf{137.64}\ \boldsymbol{\mu} \mathbf{m}$, and 194.68 $\boldsymbol{\mu}\mathbf{m}$ respectively. Conversely, the VC/UC nozzle generated the largest droplets, with Dv10, Dv50, and Dv90 values of 138.46 $\boldsymbol{\mu}\mathbf{m}, \mathbf{399.42}\ \boldsymbol{\mu}\mathbf{m}$, and $\mathbf{724.04}\ \boldsymbol{\mu}\mathbf{m}$. The variability in droplet size distributions was evident from the distribution of droplet sizes, emphasizing the significance of nozzle selection in minimizing spray drift. The obtained datasets will aid in referring each nozzle analyzed in our laboratory with our custom equipment to the standard classification, allowing objective comparison of nozzle performance toward the optimization of spray application.","","979-8-3503-5544-4","10.1109/MetroAgriFor63043.2024.10948849","European Union(grant numbers:CN00000022); ","https://ieeexplore.ieee.org/stamp/stamp.jsp?arnumber=10948849","Agricultural spray;droplet size;N60 shadowgraph;nozzles classification;spray characterization;ISO 25358","Precision agriculture;ISO Standards;Spraying;Pesticides;Market research;Size measurement;Pressure measurement;Steel;Protection;Standards","","","","27","IEEE","11 Apr 2025","","","IEEE","IEEE Conferences"
"Intelligent Sampling for Vegetation Nitrogen Mapping Based on Hybrid Machine Learning Algorithms","J. Verrelst; K. Berger; J. P. Rivera-Caicedo","Image Processing Laboratory (IPL), Universitat de València, València, Spain; Department of Geography, Ludwig-Maximilians-Universität München, Munich, Germany; Secretary of Research and Postgraduate, CONACYT-UAN, Tepic, Mexico",IEEE Geoscience and Remote Sensing Letters,"23 Nov 2021","2021","18","12","2038","2042","Upcoming satellite imaging spectroscopy missions will deliver spatiotemporal explicit data streams to be exploited for mapping vegetation properties, such as nitrogen (N) content. Within retrieval workflows for real-time mapping over agricultural regions, such crop-specific information products need to be derived precisely and rapidly. To allow fast processing, intelligent sampling schemes for training databases should be incorporated to establish efficient machine learning (ML) models. In this study, we implemented active learning (AL) heuristics using kernel ridge regression (KRR) to minimize and optimize a training database for variational heteroscedastic Gaussian processes regression (VHGPR) to estimate aboveground N content. Several uncertainty and diversity criteria were applied on a lookup table (LUT) composed of aboveground N content and corresponding hyperspectral reflectance simulated by the PROSAIL-PRO model. The best-performing AL criteria were Euclidian distance-based diversity (EBD) resulting in a reduction of the LUT training data set by 81% (50 initial samples plus 141 samples selected from a pool of 1000 samples). This reduced LUT was used for training VHGPR, which is not only a competitive algorithm but also provides uncertainty estimates. Validation against in situ N reference data provided excellent results with a root-mean-square error (RMSE) of 1.84 g/m2 and a coefficient of determination ( $R^{2}$ ) of 0.92. Mapping aboveground N content over an agricultural region yielded reliable estimates and meaningful associated uncertainties. These promising results encourage the transfer of such hybrid workflows into space and time within the frame of future operational N monitoring from satellite imaging spectroscopy data.","1558-0571","","10.1109/LGRS.2020.3014676","European Research Council (ERC) through the ERC-2017-STG SENTIFLEX Project(grant numbers:755617); Spanish Ministry of Economy and Competitiveness through the SynerTGE CGL2015-G9095-R (MINECO/FEDER, UE) Project; ESA FLuorescence EXplorer (FLEX) Calibration/Validation Campaign FLEXSense 2018(grant numbers:ESA RFP/3-15477/18/NL/NA); Ramón y Cajal Contract (Spanish Ministry of Science, Innovation and Universities); German Federal Ministry for Economic Affairs and Energy(grant numbers:50EE1623); Space Agency of the German Aerospace Center (DLR) within the Research Project EnMAP Scientific Advisory Group Phase III: Developing the EnMAP Managed Vegetation Scientific Processor; ","https://ieeexplore.ieee.org/stamp/stamp.jsp?arnumber=9169812","Active learning (AL);Gaussian processes (GP);hybrid retrieval methods;kernel ridge regression (KRR);nitrogen","Table lookup;Training;Vegetation mapping;Uncertainty;Nitrogen;Imaging;Spectroscopy","","57","","40","IEEE","17 Aug 2020","","","IEEE","IEEE Journals"
"Real-Time Semantic Segmentation in Natural Environments with SAM-assisted Sim-to-Real Domain Transfer","H. Wang; R. Mascaro; M. Chli; L. Teixeira","Vision For Robotics Lab, ETH Zürich and University of Cyprus; Vision For Robotics Lab, ETH Zürich and University of Cyprus; Vision For Robotics Lab, ETH Zürich and University of Cyprus; Vision For Robotics Lab, ETH Zürich and University of Cyprus",2024 IEEE/RSJ International Conference on Intelligent Robots and Systems (IROS),"25 Dec 2024","2024","","","53","60","Semantic segmentation plays a pivotal role in many robotic applications requiring high-level scene understanding, such as smart farming, where the precise identification of trees or plants can aid navigation and crop monitoring tasks. While deep-learning-based semantic segmentation approaches have reached outstanding performance in recent years, they demand large amounts of labeled data for training. Inspired by modern Unsupervised Domain Adaptation (UDA) techniques, in this paper, we introduce a two-step training pipeline specifically tailored to challenging natural scenes, where the availability of annotated data is often quite limited. Our strategy involves the initial training of a powerful domain adaptive architecture, followed by a refinement stage, where segmentation masks predicted by the Segment Anything Model (SAM) are used to improve the accuracy of the predictions on the target dataset. These refined predictions serve as pseudo-labels to supervise the training of a final distilled architecture for real-time deployment. Extensive experiments conducted in two real-world scenes demonstrate the effectiveness of the proposed method. Specifically, we show that our pipeline enables the training of a MobileNetV3 that achieves significant mIoU gains of 3.60% and 11.40% on our two datasets compared to the DAFormer while only demanding 1/15 of the latter’s inference time. Code and datasets are available at https://github.com/VIS4ROB-lab/nature_uda_rt_segmentation.","2153-0866","979-8-3503-7770-5","10.1109/IROS58592.2024.10801798","European Research Council; ","https://ieeexplore.ieee.org/stamp/stamp.jsp?arnumber=10801798","","Training;Smart agriculture;Adaptation models;Navigation;Semantic segmentation;Computational modeling;Pipelines;Computer architecture;Predictive models;Real-time systems","","","","42","IEEE","25 Dec 2024","","","IEEE","IEEE Conferences"
"Pseudo-label Generation for Agricultural Robotics Applications","T. A. Ciarfuglia; I. Marian Motoi; L. Saraceni; D. Nardi","Department of Computer Science, Management and Automation Engineering (DIAG), Sapienza University of Rome, Italy; Department of Computer Science, Management and Automation Engineering (DIAG), Sapienza University of Rome, Italy; Department of Computer Science, Management and Automation Engineering (DIAG), Sapienza University of Rome, Italy; Department of Computer Science, Management and Automation Engineering (DIAG), Sapienza University of Rome, Italy",2022 IEEE/CVF Conference on Computer Vision and Pattern Recognition Workshops (CVPRW),"23 Aug 2022","2022","","","1685","1693","In the context of table grape cultivation there is rising interest in robotic solutions for harvesting, pruning, precision spraying and other agronomic tasks. Perception algorithms at the core of these systems require large amounts of labelled data, which in this context is often not available.In this work, we propose a semi-supervised solution to reduce the data needed to get state-of-the-art detection and segmentation of fruits in orchards. We present the case of table grape vineyards in southern Lazio (Italy) since grapes are a difficult fruit to segment due to occlusion, color and general illumination conditions. We consider the concrete scenario where the source labelled data is wine grape, while the target data is table grape, with considerable covariate shift. Starting from a simple video input, our method generates first bounding box labels, leveraging the structure from motion information, then segmentation masks, using the same weakly generated bounding box labels and a refining step based on Grabcut.This system is able to produce labels that considerably reduce the covariate shift from source to target data and that requires very limited data acquisition effort. Comparisons with State-of-the-art supervised solutions show how our methods are able to train new models that achieve high performances with few labelled images, with very simple labelling.","2160-7516","978-1-6654-8739-9","10.1109/CVPRW56347.2022.00175","European Commission; ","https://ieeexplore.ieee.org/stamp/stamp.jsp?arnumber=9857350","","Structure from motion;Motion segmentation;Pipelines;Refining;Spraying;Lighting;Pattern recognition","","8","","25","IEEE","23 Aug 2022","","","IEEE","IEEE Conferences"
"Quantification of Hyperspectral Planes Effectiveness - A Semantic Segmentation Perspective","C. Florea; A. Racoviteanu; M. Ivanovici","Image Processing Analysis Laboratory, National University of Science and Technology POLITEHNICA, Bucharest, Romania; Image Processing Analysis Laboratory, National University of Science and Technology POLITEHNICA, Bucharest, Romania; MIV Laboratory, Transilvania University of Braşov, Braşov, Romania",2024 14th Workshop on Hyperspectral Imaging and Signal Processing: Evolution in Remote Sensing (WHISPERS),"19 Feb 2025","2024","","","1","5","Automatic monitoring of agricultural crops with remote sensing data allows significant improvement in the face of climate change and environmental degradation. Hyperspectral imaging supports this process with spectrally detailed data, which goes beyond visible spectrum. In this paper we investigate how much information is actually brought by the richness and the details of additional spectral information. The assumed perspective is that of agricultural crop semantic segmentation approached with a powerful visual transformer based solution. Into more detail, we explore the effectiveness of various spectral bands in hyperspectral images, used as input, measured by five metrics quantifying the performance of agricultural crop segmentation. The evaluation relies on the UAV-HSI database. The primary conclusion is that there is significant redundancy in hyperspectrum, yet the full spectrum provides always top results. A secondary conclusion is that the recognition of specific crops such as “cotton” and “holly” benefits from removal of certain bands.","2158-6276","979-8-3315-1313-9","10.1109/WHISPERS65427.2024.10876510","European Union; AI4AGRI project entitled “Romanian Excellence Center on Artificial Intelligence on Earth Observation Data for Agriculture” received funding from the European Union's Horizon Europe research and innovation program(grant numbers:101079136); ","https://ieeexplore.ieee.org/stamp/stamp.jsp?arnumber=10876510","remote sensing;crop segmentation;visual transformer;ranking;spectrum bands","Measurement;Visualization;Semantic segmentation;Face recognition;Redundancy;Crops;Signal processing;Transformers;Monitoring;Hyperspectral imaging","","","","15","IEEE","19 Feb 2025","","","IEEE","IEEE Conferences"
"Context-Self Contrastive Pretraining for Crop Type Semantic Segmentation","M. Tarasiou; R. A. Güler; S. Zafeiriou","Department of Computing, Imperial College London, London, U.K.; Department of Computing, Imperial College London, London, U.K.; Department of Computing, Imperial College London, London, U.K.",IEEE Transactions on Geoscience and Remote Sensing,"13 Sep 2022","2022","60","","1","17","In this article, we propose a fully supervised pretraining scheme based on contrastive learning particularly tailored to dense classification tasks. The proposed context-self contrastive loss (CSCL) learns an embedding space that makes semantic boundaries pop-up by use of a similarity metric between every location in a training sample and its local context. For crop type semantic segmentation from satellite image time series (SITS), we find performance at parcel boundaries to be a critical bottleneck and explain how CSCL tackles the underlying cause of that problem, improving the state-of-the-art performance in this task. Additionally, using images from the Sentinel-2 (S2) satellite missions we compile the largest, to our knowledge, SITS dataset densely annotated by crop type and parcel identities, which we make publicly available together with the data generation pipeline. Using that data we find CSCL, even with minimal pretraining, to improve all respective baselines and present a process for semantic segmentation at greater resolution than that of the input images for obtaining crop classes at a more granular level. The code and instructions to download the data can be found in https://github.com/michaeltrs/DeepSatModels.","1558-0644","","10.1109/TGRS.2022.3198187","ARISE Project; European Union’s Climate-KIC Agency of the European Union’s Horizon 2020 Research and Innovation Programme; ","https://ieeexplore.ieee.org/stamp/stamp.jsp?arnumber=9854891","Contrastive learning;convolutional neural networks (CNNs);crop type segmentation;deep learning;pretraining;self-attention;semantic segmentation;sentinel-2","Crops;Image resolution;Satellites;Task analysis;Signal resolution;Semantics;Image segmentation","","16","","59","IEEE","11 Aug 2022","","","IEEE","IEEE Journals"
"The Environmental Footprint of IC Production: Review, Analysis, and Lessons From Historical Trends","T. Pirson; T. P. Delhaye; A. G. Pip; G. Le Brun; J. -P. Raskin; D. Bol","ICTEAM Institute, Université catholique de Louvain, Louvain-la-Neuve, Belgium; ICTEAM Institute, Université catholique de Louvain, Louvain-la-Neuve, Belgium; ICTEAM Institute and the IMMC Institute, Université catholique de Louvain, Louvain-la-Neuve, Belgium; ICTEAM Institute, Université catholique de Louvain, Louvain-la-Neuve, Belgium; ICTEAM Institute, Université catholique de Louvain, Louvain-la-Neuve, Belgium; ICTEAM Institute, Université catholique de Louvain, Louvain-la-Neuve, Belgium",IEEE Transactions on Semiconductor Manufacturing,"3 Feb 2023","2023","36","1","56","67","Given the ubiquity of electronic devices and the urgent need to decrease our footprint in the context of global warming and planetary boundaries, it becomes critical to better quantify the environmental impacts of integrated circuit (IC) production. Our work addresses this question in three successive steps. First, we carry out a review of the data available since 2010 from four different literature categories, i.e., foundry reports, industry roadmaps, scientific literature, and life-cycle assessment databases. Then, we leverage the 27 identified sources to perform both a qualitative and quantitative analysis. We propose 10 features for characterizing the scope of studies while focusing on environmental indicators normalized per cm2, i.e., energy consumption, carbon footprint and water consumption. The analysis results highlight a clear increasing trend of the environmental footprint with CMOS technology downscaling below  $0.13~\mu \text{m}$ , despite a significant variation between the sources mainly due to scope mismatch. Finally, we show that environmental impacts per cm2 did not significantly decrease compared to historical values from 1980–2010, whereas the total silicon area produced keeps on increasing by 3.6%/year. Consequently, this work calls for urgently rethinking the road ahead with sobriety to effectively decrease the absolute environmental footprint of the IC production sub-sector.","1558-2345","","10.1109/TSM.2022.3228311","Fonds européen de développement régional (FEDER) and the Wallonia within the Wallonie-2020.EU Program; Fonds pour la formation í la Recherche dans l’Industrie et dans l’Agriculture (FRIA) through the Fonds de la Recherche Scientifique-FNRS; ","https://ieeexplore.ieee.org/stamp/stamp.jsp?arnumber=9979766","Life-cycle assessment (LCA);sustainability;cradle-to-gate;integrated circuits (IC);semiconductors;sobriety;roadmap","Integrated circuits;Production;Foundries;Databases;Market research;Industries;Energy consumption","","35","","69","IEEE","9 Dec 2022","","","IEEE","IEEE Journals"
"AgriSORT: A Simple Online Real-time Tracking-by-Detection framework for robotics in precision agriculture","L. Saraceni; I. M. Motoi; D. Nardi; T. A. Ciarfuglia",NA; NA; NA; NA,2024 IEEE International Conference on Robotics and Automation (ICRA),"8 Aug 2024","2024","","","2675","2682","The problem of multi-object tracking (MOT) consists in detecting and tracking all the objects in a video sequence while keeping a unique identifier for each object. It is a challenging and fundamental problem for robotics. In precision agriculture the challenge of achieving a satisfactory solution is amplified by extreme camera motion, sudden illumination changes, and strong occlusions. Most modern trackers rely on the appearance of objects rather than motion for association, which can be ineffective when most targets are static objects with the same appearance, as in the agricultural case. To this end, on the trail of SORT [5], we propose AgriSORT, a simple, online, real-time tracking-by-detection pipeline for precision agriculture based only on motion information that allows for accurate and fast propagation of tracks between frames. The main focuses of AgriSORT are efficiency, flexibility, minimal dependencies, and ease of deployment on robotic platforms. We test the proposed pipeline on a novel MOT benchmark specifically tailored for the agricultural context, based on video sequences taken in a table grape vineyard, particularly challenging due to strong self-similarity and density of the instances. Both the code and the dataset are available for future comparisons at: https://github.com/Lio320/AgriSORT","","979-8-3503-8457-4","10.1109/ICRA57147.2024.10610231","European Commission; National Research Centre; ","https://ieeexplore.ieee.org/stamp/stamp.jsp?arnumber=10610231","","Precision agriculture;Target tracking;Pipelines;Video sequences;Robot vision systems;Lighting;Cameras","","11","","46","IEEE","8 Aug 2024","","","IEEE","IEEE Conferences"
"Planning the Greenhouse Climatic Mapping Using an Agricultural Robot and Recurrent-Neural- Network-Based Virtual Sensors","C. Tomazzoli; D. Quaglia; S. Migliorini","Department of Computer Science, University of Verona, Verona, Italy; Department of Computer Science, University of Verona, Verona, Italy; Department of Computer Science, University of Verona, Verona, Italy",IEEE Transactions on AgriFood Electronics,"10 Oct 2024","2024","2","2","617","626","Assuming climatic homogeneity is no longer acceptable in greenhouse farming since it can result in less-than-ideal agronomic decisions. Indeed, several approaches have been proposed based on installing sensors in predefined points of interest (PoIs) to obtain a better mapping of climatic conditions. However, these approaches suffer from two main problems, i.e., identifying the most significant PoIs inside the greenhouse and placing a sensor at each PoI, which may be costly and incompatible with field operations. As regards the first problem, we propose a genetic algorithm to identify the best sensing places based on the agronomic definition of zones of interest. As regards the second problem, we exploit agricultural robots to collect climatic information to train a set of virtual sensors based on recurrent neural networks. The proposed solution has been tested on a real-world dataset regarding a greenhouse in Verona (Italy).","2771-9529","","10.1109/TAFE.2024.3460970","European Union through NextGenerationEU program; Piano Nazionale di Ripresa e Resilienza—Missione 4 Componente 2, Investimento 1.5—D.D.; Interconnected Nord-Est Innovation Ecosystem(grant numbers:ECS00000043); ","https://ieeexplore.ieee.org/stamp/stamp.jsp?arnumber=10701545","Agricultural robot;genetic algorithm (GA);microclimate mapping;recurrent neural network (RNN);virtual sensor","Trajectory;Recurrent neural networks;Monitoring;Agricultural robots;Temperature measurement;Soft sensors;Predictive models;Genetic algorithms;Soft sensors;Greenhouses","","","","48","CCBY","1 Oct 2024","","","IEEE","IEEE Journals"
