"Evaluation of Machine Learning Models for Water Stress Detection Using Stem Impedance","F. Cum; S. Calvo; A. Sanginario; U. Garlando","Department of Electronics and Telecommunications (DET), Politecnico di Torino, Torino, Italy; Department of Electronics and Telecommunications (DET), Politecnico di Torino, Torino, Italy; Department of Electronics and Telecommunications (DET), Politecnico di Torino, Torino, Italy; Department of Electronics and Telecommunications (DET), Politecnico di Torino, Torino, Italy",IEEE Transactions on AgriFood Electronics,"10 Oct 2024","2024","2","2","314","322","Food security, producing enough food for every person on the planet, is becoming a significant issue. Increasing world population and climate change are setting new challenges to food production. Water stress can cause severe damage to crops, and detecting and preventing this threat is crucial. Smart agriculture and the use of sensors directly on the field is a promising and rapidly evolving solution. Data collected by a large number of sensors must be analyzed and efficiently interpreted. In this context, machine learning is an effective solution. This article conducts a comparative analysis of several well-established machine learning models, all trained on a dataset enriched with a novel parameter for the assessment of plant health, the stem electrical impedance (modulus and phase). This feature gives promising results since it is a direct parameter of the plant itself. Moreover, the inclusion of the stem impedance parameter significantly boosted the model's performance, notably enhancing the effectiveness, particularly evident in the case of the top-performing model in this study, the random forest algorithm. When incorporating stem electrical impedance, this model achieved an impressive F1 score of 98%, markedly surpassing the 88% obtained in its absence. As a complementary analysis, a permutation feature performance analysis was conducted, highlighting the potential of stem impedance modulus as a promising feature for evaluating plant watering conditions. The removal of impedance modulus from the training model resulted in an average classification performance loss of 25% in terms of F1 score, suggesting how impedance monitoring is a promising approach for plant health management.","2771-9529","","10.1109/TAFE.2024.3457156","Agritech National Research Center and received funding from the European Union Next-GenerationEU; PIANO NAZIONALE DI RIPRESA E RESILIENZA (PNRR) MISSIONE 4 COMPONENTE 2, INVESTIMENTO 1.4 D.D. 1032 17/06/2022, CN00000022; National Recovery and Resilience Plan (NRRP); Mission 4 - Component 2 - Investment 3.1 - Call for tender No. n. 3264 of 28/12/2021 of Italian Ministry of Research; European Union NextGenerationEU; Italian Ministry of Research(grant numbers:CUP: B33C22000710006); iENTRANCE; ","https://ieeexplore.ieee.org/stamp/stamp.jsp?arnumber=10690239","Machine learning;plants monitoring;smart agriculture;stem impedance","Impedance;Machine learning;Data models;Support vector machines;Climate change;Plants (biology);Smart agriculture;Food security;Food products;Threat assessment","","1","","22","IEEE","24 Sep 2024","","","IEEE","IEEE Journals"
"A Nearest Neighbors based Data Filter for Fog Computing in IoT Smart Agriculture","F. M. Ribeiro; R. Prati; R. Bianchi; C. Kamienski","Federal University of ABC Federal Institute of Maranhão; Federal University of ABC, Santo André, Brazil; Centro Universitário FEI, São Bernardo do Campo, Brazil; Federal University of ABC, Santo André, Brazil",2020 IEEE International Workshop on Metrology for Agriculture and Forestry (MetroAgriFor),"8 Dec 2020","2020","","","63","67","In smart agriculture, the Internet of Things (IoT) makes it possible to analyze and manage agricultural yield to increase productivity, reduce wasted resources, and decrease irrigation costs. In IoT systems, if data management is entirely performed in the cloud, the system may not work correctly due to connectivity problems, which is common in some remote regions where the agribusiness thrives. A fog computing solution enables the IoT system to process data faster and deal with intermittent connectivity. However, a high number of packets sent from the fog to the cloud can cause link congestion with mostly useless data traffic. Dealing with fog data filtering is a challenge because it requires knowing which data is essential to send to the cloud. This paper proposes an approach to collect and store data in a smart agriculture environment and two different methods filtering data in the fog. We designed an experiment for each filtering method, using a real dataset containing temperature and humidity values. In both experiments, the fog filters the data using the k-Nearest-Neighbors (kNN) algorithm, which classifies data into categories according to their value ranges. In the first experiment, the fog classifies the data and generates an output of the number of data categories. In the second experiment, data is classified and also compressed based on the previously obtained categories using the runlength encoding (RLE) technique to preserve the data time series nature. Our results show that data filtering reduces the amount of data sent by the fog to the cloud.","","978-1-7281-8783-9","10.1109/MetroAgriFor50201.2020.9277661","European Commission; ","https://ieeexplore.ieee.org/stamp/stamp.jsp?arnumber=9277661","smart agriculture;fog computing;Internet of things;data filtering;machine learning","Agriculture;Cloud computing;Sensors;Humidity;Edge computing;Training;Temperature distribution","","18","","17","IEEE","8 Dec 2020","","","IEEE","IEEE Conferences"
"Availability and Accessibility of Open Data Relevant for Urban Planning: A Case Study of Zagreb, Croatia","K. Kević; H. Tomić; Z. Bačić; D. Šiško","Faculty of Geodesy, Institute of Cartography and Photogrammetry, University of Zagreb, Zagreb, Croatia; Faculty of Geodesy, Institute of Applied Geodesy, University of Zagreb, Zagreb, Croatia; Faculty of Geodesy, Institute of Geomatics, University of Zagreb, Zagreb, Croatia; City Office of Strategic Planning and Development of the City, City of Zagreb, Zagreb, Croatia",2023 International Conference on Earth Observation and Geo-Spatial Information (ICEOGI),"1 Nov 2023","2023","","","1","4","Sustainable urban development (planning) relies on up-to-date spatial and other information. Much of this data comes from government organizations, agencies and institutions which are obliged to make it open by the EU Open Data Directive (2019/1024) and Implementing Regulation (2023/138). The City of Zagreb has established spatial data infrastructure (SDI) to support the provision of spatial open government data. This paper analyses which government data relevant to urban planning is available in Zagreb SDI, in which form it can be assessed and to what extent is this data in line with the list of adopted high-value data in Europe. The results indicate that a number of spatial data exist, but data accessibility limits its reuse potential - data mostly available as view only.","","979-8-3503-9672-0","10.1109/ICEOGI57454.2023.10292981","","https://ieeexplore.ieee.org/stamp/stamp.jsp?arnumber=10292981","spatial open data;high-value data;urban planning","Earth;Government;Urban planning;Europe;Spatial databases;Regulation;Planning","","","","10","IEEE","1 Nov 2023","","","IEEE","IEEE Conferences"
"Soil Texture and pH Mapping Using Remote Sensing and Support Sampling","O. Yüzügüllü; N. Fajraoui; F. Liebisch","AgriCircle AG, Bahnhofstrasse 28b, Pfäffikon, Schwyz, Switzerland; AgriCircle AG, Bahnhofstrasse 28b, Pfäffikon, Schwyz, Switzerland; Agroscope, Water Protection, and Substance Flows, Reckenholzstrasse 191, Zurich, Switzerland",IEEE Journal of Selected Topics in Applied Earth Observations and Remote Sensing,"24 Jul 2024","2024","17","","12685","12705","Soil pH and texture are valuable information for agriculture, supporting the achievement of high productivity and low environmental impact, which is the basis for sustainable agricultural production. In this study, we present novel soil mapping techniques that integrate high-spatial-resolution satellite and ground data, surpassing traditional methods in precision and reliability. By synergizing remote sensing data, including polarimetric synthetic aperture and multispectral imagery, with climate and terrain information, alongside coarse-resolution soil data, we achieved high accuracy, with an average error of less than 6%, in predicting soil pH and texture parameters. Notably, the approach allows for detailed mapping at the pixel level, revealing nuanced variability within 10×10 m field pixels. Considering the accuracy, the method establishes itself as a benchmark for field management guidelines integrating a precision sampling approach, offering actual and high spatial resolution information crucial for sustainable agricultural practices. This holistic approach allows new opportunities to revolutionize soil management practices, facilitating variable rate applications, soil moisture, and fertilization mapping and ultimately enhancing agri-environmental sustainability.","2151-1535","","10.1109/JSTARS.2024.3422494","EJP Soil Project STEROPES(grant numbers:862695,H2020,H2020-SFS-2019-1); Stimulating Novel Technologies from Earth Remote Observation to Predict European Soil Carbon within the Horizon 2020 program scheme; ","https://ieeexplore.ieee.org/stamp/stamp.jsp?arnumber=10584110","Machine learning (ML);precision agriculture;remote sensing;soil health;soil mapping","Soil;Soil properties;Soil measurements;Soil texture;Remote sensing;Satellites;Accuracy","","10","","82","CCBY","3 Jul 2024","","","IEEE","IEEE Journals"
"A Scalable High-Performance Unsupervised System for Producing Large-Scale HR Land Cover Maps: The Italian Country Case Study","C. Paris; L. Gasparella; L. Bruzzone","University of Trento, Trento, Italy; Department of Information Engineering and Computer Science, University of Trento, Trento, Italy; Department of Information Engineering and Computer Science, University of Trento, Trento, Italy",IEEE Journal of Selected Topics in Applied Earth Observations and Remote Sensing,"1 Nov 2022","2022","15","","9146","9159","This article presents an operational system for the automatic production of high-resolution (HR) large-scale land cover (LC) maps in a fast, efficient, and unsupervised manner. This is based on a scalable and parallelizable tile-based approach, which does not require the collection of new training data. The method leverages the complementary information provided by the existing LC maps and recent acquisitions of HR Earth observation (EO) images to identify map units that have the highest probability of being correctly associated with their labels, and exploit the obtained “weak” training set to produce an updated HR LC map by classifying the recently acquired EO data. Both steps, performed at tile level, can be implemented on a high-performance computing (HPC) environment, which simultaneously process all required tiles (independently of each other) for the entire study area. The method was tested considering the publicly available 2018 Corine LC map having a minimum mapping unit of 25 ha and the Sentinel-2 images to generate an HR LC map of Italy. The obtained map has a spatial resolution of 10 m and presents the nine major LC types (i.e., “artificial land,” “bareland,” “grassland,” “cropland,” “broadleaves,” “conifers,” “snow,” “water,” and “shrubland”). Validation was performed using the 2018 European Land Use and Coverage Area Frame Survey database made up of in situ data. The overall accuracy achieved for the Northern, Southern, and Central part of Italy and the Italian Islands is 91.29%, 91.63%, 92.21%, and 91.06%, respectively.","2151-1535","","10.1109/JSTARS.2022.3209902","European Space Agency; ","https://ieeexplore.ieee.org/stamp/stamp.jsp?arnumber=9904035","Automatic classification;Corine land cover (CLC) map;Earth observation (EO);European Land Use and Coverage Area Frame Survey (LUCAS) database;high-resolution (HR) land cover (LC) maps;LC map production;Sentinel-2;unsupervised methods","Spatial resolution;Crops;Europe;Earth;Training;Snow;Soft sensors","","8","","39","CCBY","27 Sep 2022","","","IEEE","IEEE Journals"
"Simulation of Spectral Disturbance Effects for Improvement of Soil Property Estimation","R. Milewski; A. Abdelbaki; S. Chabrillat; N. Tziolas; B. Van Wesemael; S. Jacquemoud","Helmholtz Center Potsdam GFZ German Research Centre for Geosciences, Potsdam, Germany; Helmholtz Center Potsdam GFZ German Research Centre for Geosciences, Potsdam, Germany; Helmholtz Center Potsdam GFZ German Research Centre for Geosciences, Potsdam, Germany; Department of Soil and Water Sciences, University of Florida, Florida, USA; Earth and Life Institute, Université Catholique de Louvain, Louvain-la-Neuve, Belgium; Institut de Physique du Globe de Paris-Sorbonne, Université Paris Diderot UMR CNRS, Paris, France",IGARSS 2023 - 2023 IEEE International Geoscience and Remote Sensing Symposium,"20 Oct 2023","2023","","","1257","1260","This study introduces the development of Spatially Upscaled Soil Spectral Libraries (SUSSL) approach to assess spectral disturbances caused by variations in surface conditions in remote sensing-based soil property prediction. The SUSSL incorporates realistic cropland reflectance scenarios using spectral modelling and aggregation techniques. By convoluting the spectral database to multispectral and hyperspectral satellite sensors, the sensitivity of spectral indices in retrieving undisturbed surface reflectance is evaluated. Preliminary findings indicate that the spectral disturbance effects significantly impact the accuracy of soil organic carbon (SOC) estimations, resulting in a noticeable loss compared to bare soil spectra. However, strict filtering criteria using spectral indices exhibit promise in enhancing SOC modelling performance, particularly for multispectral sensors. Hyperspectral sensors demonstrate higher baseline accuracies even in disturbed soil cases. This research highlights the importance of accounting for surface condition variations for reliable soil property mapping. Future work involves leveraging machine learning techniques on SUSSL data to improve prediction accuracy and spatial coverage of soil properties using Earth Observation data.","2153-7003","979-8-3503-2010-7","10.1109/IGARSS52108.2023.10282492","European Space Agency; ","https://ieeexplore.ieee.org/stamp/stamp.jsp?arnumber=10282492","Soil spectral modelling;SOC;moisture;roughness;crop residues","Reflectivity;Earth;Sensitivity;Satellites;Soil properties;Estimation;Machine learning","","","","9","IEEE","20 Oct 2023","","","IEEE","IEEE Conferences"
"Self-Supervised Learning on Small In-Domain Datasets Can Overcome Supervised Learning in Remote Sensing","A. J. Sanchez-Fernandez; S. Moreno-Álvarez; J. A. Rico-Gallego; S. Tabik","Department of Computer Systems Engineering and Telematics, School of Technology, University of Extremadura, Cáceres, Spain; Department of Computer Languages and Systems, National University of Distance Education, UNED, Madrid, Spain; CénitS-COMPUTAEX: Extremadura Center for Research, Technological Innovation, and Supercomputing, Cáceres, Spain; Department of Computer Science and Artificial Intelligence, Andalusian Research Institute in Data Science and Computational Intelligence, DaSCI, University of Granada, Granada, Spain",IEEE Journal of Selected Topics in Applied Earth Observations and Remote Sensing,"24 Jul 2024","2024","17","","12797","12810","The availability of high-resolution satellite images has accelerated the creation of new datasets designed to tackle broader remote sensing (RS) problems. Although popular tasks, such as scene classification, have received significant attention, the recent release of the Land-1.0 RS dataset marks the initiation of endeavors to estimate land-use and land-cover (LULC) fraction values per RGB satellite image. This challenging problem involves estimating LULC composition, i.e., the proportion of different LULC classes from satellite imagery, with major applications in environmental monitoring, agricultural/urban planning, and climate change studies. Currently, supervised deep learning models—the state-of-the-art in image classification—require large volumes of labeled training data to provide good generalization. To face the challenges posed by the scarcity of labeled RS data, self-supervised learning (SSL) models have recently emerged, learning directly from unlabeled data by leveraging the underlying structure. This is the first article to investigate the performance of SSL in LULC fraction estimation on RGB satellite patches using in-domain knowledge. We also performed a complementary analysis on LULC scene classification. Specifically, we pretrained Barlow Twins, MoCov2, SimCLR, and SimSiam SSL models with ResNet-18 using the Sentinel2GlobalLULC small RS dataset and then performed transfer learning to downstream tasks on Land-1.0. Our experiments demonstrate that SSL achieves competitive or slightly better results when trained on a smaller high-quality in-domain dataset of 194 877 samples compared to the supervised model trained on ImageNet-1k with 1 281 167 samples. This outcome highlights the effectiveness of SSL using in-distribution datasets, demonstrating efficient learning with fewer but more relevant data.","2151-1535","","10.1109/JSTARS.2024.3421622","SmartFoRest; European Union NextGenerationEU/ PRTR(grant numbers:TED2021-129690B-I00); Ministerio de Ciencia e Innovación(grant numbers:PID2019-110315RB-I00); European Regional Development Fund; Junta de Extremadura(grant numbers:IB20040); Thematic Center on Mountain Ecosystem & Remote sensing, Deep learning-AI e-Services University of Granada-Sierra Nevada; Ministerio de Ciencia e Innovación; FEDER funds from the Spanish Pluriregional Operational(grant numbers:LifeWatch-2019-10-UGR-01); LifeWatch-ERIC action line(grant numbers:LifeWatch-2019-10-UGR-01_WP-8,LifeWatch-2019-10-UGR-01_WP-7,LifeWatch-2019-10-UGR-01_WP-4); ","https://ieeexplore.ieee.org/stamp/stamp.jsp?arnumber=10582406","Deep learning;fraction estimation;land use and land cover (LULC);multispectral data;remote sensing (RS);RGB satellite images;self-supervised learning (SSL)","Task analysis;Estimation;Scene classification;Satellites;Satellite images;Deep learning;Computational modeling;Climate change;Remote sensing;Self-supervised learning;Land use planning","","3","","44","CCBY","2 Jul 2024","","","IEEE","IEEE Journals"
"Soil Nitrogen Forecasting From Environmental Variables Provided By Multisensor Remote Sensing Images","W. Zhao; G. Chuluunbat; A. Unagaev; N. Efremova","Deep Planet, London, UK; Deep Planet, London, UK; Deep Planet, London, UK; Queen Mary University and the Alan Turing Institute, London, UK",IGARSS 2024 - 2024 IEEE International Geoscience and Remote Sensing Symposium,"5 Sep 2024","2024","","","4272","4275","This study introduces a framework for forecasting soil nitrogen content, leveraging multi-modal data, including multi-sensor remote sensing images and advanced machine learning methods. We integrate the Land Use/Land Cover Area Frame Survey (LUCAS) database, which covers European and UK territory, with environmental variables from satellite sensors to create a dataset of novel features. We further test a broad range of machine learning algorithms, focusing on tree-based models such as CatBoost, LightGBM, and XGBoost. We test the proposed methods with a variety of land cover classes, including croplands and grasslands to ensure the the robustness of this approach. Our results demonstrate that CatBoost model surpasses other methods in accuracy. This research not only advances the field of agricultural management and environmental monitoring but also demonstrates the significant potential of integrating multisensor remote sensing data with machine learning for environmental analysis.","2153-7003","979-8-3503-6032-5","10.1109/IGARSS53475.2024.10642927","","https://ieeexplore.ieee.org/stamp/stamp.jsp?arnumber=10642927","Soil Nitrogen;Machine Learning;Remote Sensing;Environmental Variables","Grasslands;Satellites;Databases;Biological system modeling;Land surface;Machine learning;Soil","","1","","9","IEEE","5 Sep 2024","","","IEEE","IEEE Conferences"
"An Assessment of the Applicability of Three Reanalysis Snow Density Datasets Over China Using Ground Observations","S. Gao; Z. Li; P. Zhang; J. Zeng; Q. Chen; C. Zhao; C. Liu; Z. Wu; H. Qiao","Key Laboratory of Digital Earth Science, Aerospace Information Research Institute, Chinese Academy of Sciences, Beijing, China; Key Laboratory of Digital Earth Science, Aerospace Information Research Institute, Chinese Academy of Sciences, Beijing, China; Key Laboratory of Digital Earth Science, Aerospace Information Research Institute, Chinese Academy of Sciences, Beijing, China; State Key Laboratory of Remote Sensing Science, Aerospace Information Research Institute, Chinese Academy of Sciences, Beijing, China; Key Laboratory of Digital Earth Science, Aerospace Information Research Institute, Chinese Academy of Sciences, Beijing, China; Northwest Land and Resources Research Center, Shaanxi Normal University, Xi’an, China; Key Laboratory of Digital Earth Science, Aerospace Information Research Institute, Chinese Academy of Sciences, Beijing, China; Key Laboratory of Digital Earth Science, Aerospace Information Research Institute, Chinese Academy of Sciences, Beijing, China; Key Laboratory of Digital Earth Science, Aerospace Information Research Institute, Chinese Academy of Sciences, Beijing, China",IEEE Geoscience and Remote Sensing Letters,"16 Sep 2022","2022","19","","1","5","Snow density is an important variable in snowpack research. The comprehensive applicability evaluation of the snow density datasets is a prerequisite of these datasets for their applications in hydrology processes and climate change, as well as in snow equivalent water retrieval algorithms. In this letter, the applicability of three snow density datasets, including European ReAnalysis (ERA)-Interim, ERA5, and the newly released ERA5-Land datasets, was first assessed using two ground evaluation datasets with different land covers from seven snow survey courses and four densely sampled networks in China. The results show that the ERA-Interim dataset significantly overestimates snow density during the entire snow season, with an overall root mean square error (RMSE) larger than 112 kg/m3, and lacks temporal dynamics. The ERA5 and ERA5-Land datasets are generally in good agreement with the ground measurements in China. The averaged RMSEs of the ERA5 dataset are 56.2 kg/m3 against snow course sites and 28.3 kg/m3 versus the densely sampled measurements, and those of the ERA5-Land dataset are 56.6 and 28.4 kg/m3, respectively. However, the ERA5 and ERA5-Land datasets still underestimate snow density over time, especially for the middle and late snow seasons. These new findings are expected to provide valuable feedback to model developers to further enhance the accuracy of snow density datasets.","1558-0571","","10.1109/LGRS.2022.3202897","National Key Research and Development Program of China(grant numbers:2018YFA0605403); Key Deployment Program of Aerospace Information Research Institute, Chinese Academy of Sciences (AIRCAS)(grant numbers:Y950930Z2F); International Partnership Program of Chinese Academy of Sciences(grant numbers:131C11KYSB20160061); National Natural Science Foundation of China(grant numbers:41976171); Youth Innovation Promotion Association CAS(grant numbers:2018082); ","https://ieeexplore.ieee.org/stamp/stamp.jsp?arnumber=9894045","China;European ReAnalysis (ERA)-Interim;ERA5;ERA5-Land;evaluation;ground measurements;snow density","Correlation coefficient;Hydrology;Climate change;Density measurement;Snow;Geoscience and remote sensing;Europe","","5","","16","IEEE","16 Sep 2022","","","IEEE","IEEE Journals"
