DOI,Title,Authors,Year,Abstract,Include,Reason,Data Source
10.1007/s13132-023-01150-x,An Application of the Life Satisfaction Approach (LSA) to Value the Land Consumption and Ecosystem Services,"M., Bravi, Marina; M.C., Bottero, Marta Carla; F., Dell'Anna, Federico",2024,"Land systems combine land use and land cover, considering that their changes have important consequences for the local environment and human well-being and are pervasive factors of regional and global environmental change. More specifically, land consumption (LC), due to the occupation of originally agricultural, natural, or semi-natural areas, implies a progressive loss of key environmental resources and ecosystem services (ESs), reducing the individual well-being. Furthermore, policy makers need data on the benefits of public goods in monetary terms to support well-being-oriented decision-making. This work seeks to demonstrate that life satisfaction approach (LSA) can be applied to a practical assessment goal with the intention to give a monetary value to the LC and consequently to a loss of important ESs. The Italian case study is investigated with the help of a national survey database reporting the subjective well-being index (SWBI) subsequently grouped by regions. The overall intent is to make explicit to the policymakers that biodiversity and ESs are valuable to society and that their further degradation will result in irreversible damages to local communities. Using nationally representative data from the Multi-Purpose Survey on Italian Families in Italy over 2012–2016, results suggest that the national average annual income willingness to accept (WTA) related to consumed land is equal to −0.0827 €/m2 on average, while the social cost for LC and the loss of related ESs affects 0.01% of the Italian GDP per year. Finally, the possibility of estimating and comparing the WTA with the land market values brings the method presented here closer to cost-based estimates overcoming the limitations of contingent valuation methods. © 2024 Elsevier B.V., All rights reserved.",yes,"The abstract mentions using a national survey database for Italy to study land consumption of agricultural areas, meeting all inclusion criteria.",Multi-Purpose Survey on Italian Families
10.1016/j.jenvman.2023.119992,Non-monetary motivations of the EU agri-environmental policy adoption. A causal forest approach,"R., Esposti, Roberto",2024,"This paper investigates the non-monetary motivations of farmers' adoption of agri-environmental policies. Unlike the monetary (income) motivations, non-monetary drivers can not be directly observed but can be identified from observational data within appropriate quasi-experimental designs. A theoretical justification of farmers' choices is first formulated and a consequent natural experiment setting is derived. The latter admits heterogeneous, i.e. Individual, Treatment Effects (ITE) that, in turn, can be interpreted in terms of more targeted and tailored policy expenditure. A Causal Forest (CF) approach is adopted to estimate these ITEs for both the treated and not treated units. The approach is applied to two balanced panel samples of Italian Farm Accountancy Data Network (FADN) farms observed over the 2008–2018 period and concerns agri-environmental policies delivered through the Common Agricultural Policy (CAP). Results show how heterogeneous the farmers’ response and the associated non-monetary motivations can be, thus indicating room for a more efficient policy design. © 2024 Elsevier B.V., All rights reserved.",yes,"The abstract explicitly states the use of the Italian Farm Accountancy Data Network (FADN) dataset, which meets all inclusion criteria.",Farm Accountancy Data Network;FADN
10.3390/su152416621,Economic and Environmental Sustainability Trade-Off Analysis in Sheep Farming Using the Farm Accountancy Data Network Database,"P., Sau, Paola; B., Arru, Brunella; F., Cisilino, Federica; R., Furesi, Roberto; P., Pulina, Pietro; F.A., Madau, Fabio Albino",2023,"Agriculture and livestock farming significantly contribute to the success of all United Nations Sustainable Development Goals of Agenda 2030 and are pivotal in the sustainability transition of the European agri-food sector. However, those sectors have been criticized for generating negative environmental externalities. In this context, adopting indicators able to evaluate agriculture and sheep farming sustainability is essential for fostering sustainable development in the primary sector and defining appropriate policies to support it. Such indicators are crucial for understanding if European Union policies striving to realize win–win opportunities based on synergy between farms’ environmental and economic dimensions are realistic. This paper focuses on this wave of interest and has two aims. First, it intends to investigate the existence of synergies or trade-offs between those dimensions using a trade-off analysis. To this end, a significant set of economic and environmental farm indicators was selected, and two composite indicators were created. Second, it aims to investigate the relationship between those two indicators and some pivotal structural and socio-demographic variables. This study was carried out on 219 Sardinian sheep farms included in the Italian Farm Accountancy Data Network. The findings showed a low synergy between the economic and environmental spheres, a relationship between economic indicators and farmers’ ages and organic production variables, and no relationships between the environmental dimension and the analyzed variables. © 2024 Elsevier B.V., All rights reserved.",yes,"The study uses data from the Italian Farm Accountancy Data Network, a national-level dataset, which meets all criteria.",Farm Accountancy Data Network;FADN
10.1016/j.cesys.2023.100131,Life Cycle Inventory of the Italian citrus fruit supply chain: Modelling the agricultural phase inventory through statistical data processing,"G., Vono, Gregorio; G., Falcone, Giacomo; M., Mistretta, Marina; A., Fazari, Antonio; A., Strano, A.",2023,"In the application of Life Cycle Assessment (LCA) methodology, the main data resources are represented by commercial databases, which scarcely describe Italian production realities. Given the importance of the LCA methodology for assessing the environmental impacts generated by agricultural processes, the creation of a regionalised and site-specific inventory for Italian agri-food production, which includes all life cycle phases of the main national agri-food chains, is a relevant tool to support the ecological transition towards development models based on the circular economy. This paper is part of the research activities of a project aimed to develop an Italian Life Cycle Inventory (LCI) database of agri-food products and is aimed to propose an approach for the collection of inventory data based on secondary sources specific to Italian agricultural production. In particular, this contribution reports the first results of modelling the national citrus fruit supply chain by using an integrated approach of data processed from statistical sources, regional production specifications and technical-professional manuals. Inputs about macronutrients, determined through an adjustment of the standard doses in normality situations reported within the Agronomic Technical Guides, are on average 7.30 kg of nitrogen, 3.58 kg of Phosphorous and 5.58 kg of potassium per ton of oranges production. The active ingredients most used in cultivation are Pyriproxyfen, Phosmet, Azadirachtin and Mineral Oils for the control of the principal pest insects and mites, while the recurring use of cupric products and Mancozeb is strictly linked to the control of fungal diseases. The analysis resulted in 47 process sheets for the cultivation of orange, lemon, mandarin, clementine, and minor citrus fruits. © 2023 Elsevier B.V., All rights reserved.",yes,"The paper describes the creation of an Italian Life Cycle Inventory (LCI) database for agri-food products, which is a dataset with national Italian coverage.",Italian Life Cycle Inventory database
10.1016/j.foodpol.2023.102521,Unfair trading practices and countervailing power,"C., Russo, Carlo; F., Di Marcantonio, Federica; L., Cacchiarelli, Luca; L., Menapace, Luisa; A., Sorrentino, Alessandro",2023,"This paper investigates whether countervailing power of collective initiatives (cooperatives, producer organizations, associations) can mitigate unfair trading practices in agricultural markets. The study hypothesis is that collective initiatives exerting countervailing power can attenuate the imbalance in the distribution of bargaining power that is considered one of the main causes of unfair trading practices. Our findings suggest that in a multidimensional bargaining setting where all contract terms are negotiated at once, there is no theoretical expectation that exerting countervailing power necessarily results in a mitigation of unfair trading practices. To investigate the topic empirically, we used a data set measuring fairness perception of a sample of Italian kiwifruit producers. The data support the hypothesis that membership in collective initiatives increases the probability that a farmer perceives a transaction as fair. However, countervailing power does not counter all unfair practices in the same way. While patrons of collective initiatives perceive benefits in price and quality determination practices, no such effect was found for contract renegotiation. The analysis compares two policy approaches: supporting countervailing power and banning specific practices (such as EU Directive 633/2019). We conclude that countervailing power is less effective in targeting specific unfair practices, but it is less likely to determine efficiency loss because it does not impose constraints on contractual negotiations. © 2023 Elsevier B.V., All rights reserved.",maybe,"The abstract mentions a dataset of Italian kiwifruit producers, but it is unclear if this dataset has national-level coverage or is from a specific region.",
10.1111/itor.13141,Using accounting dataset for agricultural sustainability assessment through a multi-criteria approach: an Italian case study,"A., Boggia, Antonio; F.F., Fagioli, Filippo Fiume; L., Paolotti, Luisa; F., Ruiz, Francisco; J.M., Cabello, J. M.; L., Rocchi, Lucia",2023,"Sustainability has become a key issue for agricultural systems. In this context, sustainability assessment implies considering different aspects of agricultural activities, including environmental, economic and social issues, and it is usually based on practice-based indicators. However, proposed methods and applications are still rare due to the difficulty to build a strong general framework and to find appropriate data. The present work develops a performance indicator framework using farm accounting data from the Italian Agricultural Accounting Information Network and proposes a multi-criteria approach based on the multiple reference point weak-strong composite indicators (MRP-WSCI) method to assess the degree of sustainability at the farm level. This method, widely applied to sustainability assessment, calculates the relative rankings including the weak and strong approaches to sustainability and facilitates an understanding of the different indices used, but it is still unused in the agricultural sector. The proposed evaluation framework shows that MRP-WSCI can handle a holistic set of indicators and rank the farms according to their level of sustainability, making it suitable for the agricultural farm sustainability assessment. Our results show that none of the farms in the case study sample can be classified as “good,” according to some of the indices produced, that is, the strong–strong and strong–weak index, while just two of them are good for the weak–weak index. Although the size of the sample used is small, the methodological approach proposed can be straightforwardly extended to larger samples. This methodology can provide information regarding the sustainability of farms to regional and/or national agricultural offices, agricultural extension workers, and farmers themselves, helping in understanding issues in specific dimensions. © 2023 Elsevier B.V., All rights reserved.",yes,"The abstract states the use of data from the Italian Agricultural Accounting Information Network (FADN), a national-level dataset for Italy.",Italian Agricultural Accounting Information Network;FADN
10.3390/land12061230,The Tuscany Integrated Supply Chain Projects 2014–2022: A New Path to Support the Agri-Food Industry,"F., Cisilino, Federica; A., Giampaolo, Antonio; F., Licciardo, Francesco; M., Orlando, Matteo; S., Tarangioli, Serena",2023,"The Integrated Supply Chain Projects (ISCP) are promoted under the framework of Rural Development Programs (RDPs). Considering the scarce literature on ISCP, the case of Tuscany, one of the Italian regions that has implemented ISCPs most aggressively, was analyzed. The aim of this work is to give evidence of the potential positive effects of ISCPs for the agricultural sector by considering the differences between ISCP beneficiaries (treated) and non-ISCP farms (non-treated). The materials used for the analysis are twofold: the Italian Rural Network database and the Italian Farm Accountancy Data Network (FADN) dataset. The analysis is based on a three-year period (2018–2020). The sample consists of 1693 farms, outliers excluded. The treated farms included in the FADN sample total 134. The variables used are both structural and economic. The statistical analysis carried out compares treated and non-treated farms using the Welch-t-test. The results show that some key variables are significant (area; labour; revenues and costs). In general, the treated farms are more likely to improve their production process through EU funding and through new investments. In conclusion, the ISCP could be a good opportunity to support the sector. This work suggests that beneficiaries could achieve higher economic performance, especially when carrying out diversified activities. © 2024 Elsevier B.V., All rights reserved.",yes,"The abstract mentions the use of two national-level Italian datasets (Italian Rural Network database and FADN), meeting all criteria.",Italian Rural Network database;Italian Farm Accountancy Data Network;FADN
10.3390/land12020301,The Farm’s Orientation towards Sustainability: An Assessment Using FADN Data in Italy,"C., Cardillo, Concetta; A., Di Fonzo, Antonella; C., Liberati, Claudio",2023,"The new Common Agricultural Policy (CAP) for the period 2023–2027 commits farmers towards achieving ambitious environmental objectives through farm organization and management. This European agricultural policy has adapted to the contemporary challenges faced by the new model of agricultural development. It aims to enhance the contribution of agriculture to the EU’s environmental and climate objectives while providing better targeted support to small-scale farmers to promote farms’ competitiveness. The main objective of this paper is to describe Italian farms and classify them into groups based on their main characteristics, as well as to analyze their performance and behavior in terms of sustainability and competitiveness. The novelty and innovativeness of this study are found in the data used; a 2020 dataset from the Italian Farm Accounting Data Network (FADN) was used. The quality of FADN data in farm sustainability assessment is widely acknowledge in the literature. To achieve the purpose of this study, a multivariate analysis, in particular, the Principal Components Analysis (PCA), and a Cluster Analysis (CA) were applied. These analyses helped us to obtain the factorial axes which then enabled us to identify economic information on farms, and a better interpretation of farmers’ aptitude to undertake environmentally friendly actions. As a result, eight groups of farms were identified, and their characteristics and performance were described at Italian district level. The results of the study reflect the influence of European interventions towards encouraging farmers to use more environmentally friendly agricultural practices. Under this perspective, the findings contribute to the current debate on green architecture pursued by the future European agricultural policy. © 2024 Elsevier B.V., All rights reserved.",yes,"The abstract explicitly states the use of the Italian Farm Accountancy Data Network (FADN), which is a national-level dataset for Italy.",Italian Farm Accounting Data Network;FADN
10.36253/rea-13209,The role of diversification in the revenue composition of Italian farms,"R., Henke, Roberto; O., Cimino, Orlando; F., Vanni, Francesco",2022,"The main aim of this paper is to analyse the evolution, patterns and models of revenue diversification in Italian agriculture in different contexts and for different typologies of farms. The analysis is based on the calculation of the inverse of Herfindahl index, by using different variables available in the Italian FADN database (years 2008, 2013 and 2018), followed by a multiple regression model to analyse the relationship between the diversification index and other variables, in order to highlight both the internal and external factors affecting on-farm diversification processes. The article shows that Italian farms have increasingly adopted non-agricultural revenue diversification strategies to reduce risk and maximize factors’ productivity. Among these, agritourism is by far the most relevant; however, in the last few years the production of renewable energy has been growing relatively rapidly. Overall, the study shows that on-farm diversification activities can be either an opportunity for a new entrepreneurship in agriculture or a survival strategy for small and marginal farms that are not sufficiently integrated in the national agri-food system. © 2023 Elsevier B.V., All rights reserved.",yes,"The abstract explicitly mentions the use of the Italian FADN database, which is an agricultural dataset with national coverage for Italy.",Italian FADN
10.1504/IJSAMI.2022.123047,The new Italian web database to support irrigation investment policies: DANIA,"M., Ferrigno, Marianna; R., Lorenzetti, Romina; L.A., Folino, Luca Adolfo; R., Zucaro, Raffaella",2022,"This paper presents the Italian national database of investment for irrigation and environment (DANIA), providing a multi-functional and interoperable tool for Italian policy makers and water resource management actors. DANIA was born in collaboration with the Italian regions and consists of a harmonised collection of collective irrigation interventions, both planned and financed, managed by irrigation entities, for the purposes of irrigation or hydrogeological instability defence. The technical, financial, and environmental data are useful for planning, monitoring financial progress, and evaluating policy effectiveness. Standardised codes allow a semantic interoperability with other national databases, particularly with SIGRIAN - the National Information System for Water Management in Agriculture. DANIA has already been applied to support the planning and monitoring of irrigation investments in Italy. © 2022 Elsevier B.V., All rights reserved.",yes,"The paper introduces DANIA, an Italian national database for irrigation, which is an agricultural data source with exclusively Italian coverage. It also mentions SIGRIAN.",DANIA; SIGRIAN
10.1186/s12711-021-00685-4,Runs of homozygosity in the Italian goat breeds: impact of management practices in low-input systems,"M., Cortellari, Matteo; A., Bionda, Arianna; A., Negro, Alessio; S., Frattini, Stefano; S., Mastrangelo, Salvatore; E., Somenzi, Elisa; E., Lasagna, Emiliano; F.M., Sarti, Francesca Maria; E., Ciani, Elena; R., Ciampolini, Roberta",2021,"Background: Climate and farming systems, several of which are considered as low-input agricultural systems, vary between goat populations from Northern and Southern Italy and have led to different management practices. These processes have impacted genome shaping in terms of inbreeding and regions under selection and resulted in differences between the northern and southern populations. Both inbreeding and signatures of selection can be pinpointed by the analysis of runs of homozygosity (ROH), which provides useful information to assist the management of this species in different rural areas. Results: We analyzed the ROH distribution and inbreeding (F<inf>ROH</inf>) in 902 goats from the Italian Goat Consortium2 dataset. We evaluated the differences in individual ROH number and length between goat breeds from Northern (NRD) and Central-southern (CSD) Italy. Then, we identified the signatures of selection that differentiate these two groups using three methods: ROH, ΔROH, and averaged F<inf>ST</inf>. ROH analyses showed that some Italian goat breeds have a lower inbreeding coefficient, which is attributable to their management and history. ROH are longer in breeds that are undergoing non-optimal management or with small population size. In several small breeds, the ROH length classes are balanced, reflecting more accurate mating planning. The differences in climate and management between the NRD and CSD groups have resulted in different ROH lengths and numbers: the NRD populations bred in isolated valleys present more and shorter ROH segments, while the CSD populations have fewer and longer ROH, which is likely due to the fact that they have undergone more admixture events during the horizontal transhumance practice followed by a more recent standardization. We identified four genes within signatures of selection on chromosome 11 related to fertility in the NRD group, and 23 genes on chromosomes 5 and 6 related to growth in the CSD group. Finally, we identified 17 genes on chromosome 12 related to environmental adaptation and body size with high homozygosity in both groups. Conclusions: These results show how different management practices have impacted the level of genomic inbreeding in two Italian goat groups and could be useful to assist management in a low-input system while safeguarding the diversity of small populations. © 2021 Elsevier B.V., All rights reserved.",yes,"The abstract clearly states the use of the 'Italian Goat Consortium2 dataset', which is an agricultural dataset with national coverage for Italy.",Italian Goat Consortium2 dataset
10.1051/e3sconf/202123807002,Waste food reduction as a way to reduce resources and energy consumption in the Italian industrial sector: An IO-LCA analysis,"P., Bartocci, Pietro; Q., Yang, Qing; H., Zhou, Hewen; B., Chen, Bin; F., Fantozzi, Francesco",2021,"Food production involves both agricultural and industrial activities which consume several resources among which: water, energy, land, minerals and chemicals. The efficiency in the use of the resources depends on the type of food which is produced and the adopted processes. In any case if food is discarded or lost at any step of the supply chain this represents a waste of energy and resources. For this reason, the LIFE project irexfo, coordinated by the University of Perugia has proposed a way to promote a business model aiming at both: the reduction of food losses and also the reuse of the not comestible food waste in biogas plants. The model has been tested in Umbria as a pilot region and in this study the results obtained are scaled up to a national level and applied to the Italian IO database reported in the EXIOBASE, to evaluate which could be the benefits of the application of the irexfo business model to the whole Italian agroindustry sector and also the interrelations between this sector and the Italian energy sector. The analysis is performed using SimaPro software 9.0, results are compared with those of similar studies which have been performed at European level. This is the first study of this kind focused on Italy. © 2021 Elsevier B.V., All rights reserved.",yes,"The study uses the Italian IO database from EXIOBASE to analyze the Italian agroindustry sector, meeting the criteria for agricultural focus and national coverage.",EXIOBASE
