DOI,Title,Authors,Year,Abstract,Include,Reason,Data Source
10.1186/s13021-021-00182-7,Validating the regional estimates of changes in soil organic carbon by using the data from paired-sites: the case study of Mediterranean arable lands,"Schillaci, Calogero; Saia, Sergio; Lipani, Aldo; Perego, Alessia; Zaccone, Claudio; Acutis, Marco",2021,"Background Legacy data are unique occasions for estimating soil organic carbon (SOC) concentration changes and spatial variability, but their use showed limitations due to the sampling schemes adopted and improvements may be needed in the analysis methodologies. When SOC changes is estimated with legacy data, the use of soil samples collected in different plots (i.e., non-paired data) may lead to biased results. In the present work, N = 302 georeferenced soil samples were selected from a regional (Sicily, south of Italy) soil database. An operational sampling approach was developed to spot SOC concentration changes from 1994 to 2017 in the same plots at the 0-30 cm soil depth and tested. Results The measurements were conducted after computing the minimum number of samples needed to have a reliable estimate of SOC variation after 23 years. By applying an effect size based methodology, 30 out of 302 sites were resampled in 2017 to achieve a power of 80%, and an alpha = 0.05. A Wilcoxon test applied to the variation of SOC from 1994 to 2017 suggested that there was not a statistical difference in SOC concentration after 23 years (Z = - 0.556; 2-tailed asymptotic significance = 0.578). In particular, only 40% of resampled sites showed a higher SOC concentration than in 2017. Conclusions This finding contrasts with a previous SOC concentration increase that was found in 2008 (75.8% increase when estimated as differences of 2 models built with non-paired data), when compared to 1994 observed data (Z = - 9.119; 2-tailed asymptotic significance < 0.001). This suggests that the use of legacy data to estimate SOC concentration dynamics requires soil resampling in the same locations to overcome the stochastic model errors. Further experiment is needed to identify the percentage of the sites to resample in order to align two legacy datasets in the same area.",no,"The study uses a regional soil database for Sicily, not a dataset with national Italian coverage.",
10.1016/j.still.2024.106212,A geospatial approach for evaluating impact and potentiality of conservation farming for soil health improvement at regional and farm scale,"Castaldi, Fabio; Buttafuoco, Gabriele; Bertinaria, Flavio; Toscano, Piero",2024,"Soil organic matter (SOM) is a key factor in sustaining soil fertility, sequestering greenhouse gases and reducing soil erosion, in this regard, an accurate estimation and monitoring of the SOM content is crucial for sustainable land management and climate change mitigation strategies. In recent years, there has been a growing consciousness of the need to better understand the dynamics of SOM across different farm management in time and space. In this context, the main objective of the study is to improve understanding regarding the relationship between SOM and the main farming systems adopted in Italy by taking spatial correlation into account. For this purpose, a large dataset consisting of topsoil SOM values (0 - 20 cm) and environmental and farming information was collected in 597 locations (145 fields and 62 farms) representative of the whole agricultural area of Po Valley in Italy. This sizable dataset was analyzed by a novel geospatial analysis using a de-clustering approach in combination with polygon kriging for detecting and understanding the SOM variability over the different fields characterized by irregular shapes and different farming systems. The results provided clear evidences of the spatial correlation between SOM, farming systems and soil types. Higher SOM contents were detected in Cambisols (3.11 %) and in field managed according conservation agriculture practices (3.22 %) as compared to other farming systems. Moreover the inclusion of fodder crops in the rotation and the use of no-tillage are two of the most effective practices for increasing and preserving SOM according to our findings. Spatial information, such those provided in this study, could facilitate the delineation of tailored solutions for each European Member State for targeting future actions related to carbon farming, and offering crucial insights to support advancements in agriculture for enhancing soil fertility and health and for fostering sustainable agricultural practices.",no,"The dataset covers the Po Valley, which is a region of Italy, not the entire nation.",
10.1038/s41597-023-02034-0,"Agrimonia: a dataset on livestock, meteorology and air quality in the Lombardy region, Italy","Fasso, Alessandro; Rodeschini, Jacopo; Moro, Alessandro Fusta; Shaboviq, Qendrim; Maranzano, Paolo; Cameletti, Michela; Finazzi, Francesco; Golini, Natalia; Ignaccolo, Rosaria; Otto, Philipp",2023,"The air in the Lombardy region, Italy, is one of the most polluted in Europe because of limited air circulation and high emission levels. There is a large scientific consensus that the agricultural sector has a significant impact on air quality. To support studies quantifying the role of the agricultural and livestock sectors on the Lombardy air quality, this paper presents a harmonised dataset containing daily values of air quality, weather, emissions, livestock, and land and soil use in the years 2016-2021, for the Lombardy region. The daily scale is obtained by averaging hourly data and interpolating other variables. In fact, the pollutant data come from the European Environmental Agency and the Lombardy Regional Environment Protection Agency, weather and emissions data from the European Copernicus programme, livestock data from the Italian zootechnical registry, and land and soil use data from the CORINE Land Cover project. The resulting dataset is designed to be used as is by those using air quality data for research.",no,"The paper presents the Agrimonia dataset, which has regional coverage (Lombardy), not national.",
10.3168/jdsc.2022-0240,Evaluation of Intergovernmental Panel on Climate Change (IPCC) equations to predict enteric methane emission from lactating cows fed Mediterranean diets,"Colombini, S.; Graziosi, A. Rota; Galassi, G.; Gislon, G.; Crovetto, G. M.; Enriquez-Hidalgo, D.; Rapetti, L.",2023,"The study aimed to evaluate Intergovernmental Panel on Climate Change (IPCC) Tier 2 (2006 and 2019) to predict enteric CH 4 emissions from lactating cows fed Mediterranean diets. The effects of the CH 4 conversion factor (Y m ; CH 4 energy loss as a percentage of gross energy intake) and digestible energy (DE) of the diet were evaluated as model predictors. A data set was created using individual observations derived from 3 in vivo studies on lactating dairy cows housed in respiration chambers and fed diets typical of the Mediterranean region based on silages and hays. Five models using different Y m and DE were evaluated following a Tier 2 approach: (1) average values of Y m (6.5%) and DE (70%) from IPCC (2006); (2) average value of Y m (5.7%) and DE (70.0%) from IPCC (2019; 1YM); (3) Y m = 5.7% and DE measured in vivo (1YMIV); (4) Y m = 5.7 or 6.0%, depending on dietary NDF, and DE = 70% (2YM); and (5) Y m = 5.7 or 6.0%, depending on dietary NDF, and DE measured in vivo (2YMIV). Finally, a Tier 2 model for Mediterranean diets (MED) was derived from the Italian data set (Y m = 5.58%; DE = 69.9% for silage-based diets and 64.8% for hay-based diets) and validated on an independent data set of cows fed Mediterranean diets. The most accurate models tested were 2YMIV, 2YM, and 1YMIV with predictions of 384, 377, and 377 (g of CH 4 /d), respectively, versus the in vivo value of 381. The most precise model was 1YM (slope bias = 1.88%; r = 0.63). Overall, 1YM showed the highest concordance correlation coefficient value (0.579), followed by 1YMIV (0.569). Cross-validation on an independent data set of cows fed Mediterranean diets (corn silage and alfalfa hay) resulted in concordance correlation coefficient of 0.492 and 0.485 for 1YM and MED, respectively. The prediction of MED (397) was more accurate than 1YM (405) in comparison with the corresponding in vivo value of 396 g of CH 4 /d. The results of this study showed that the average values proposed by IPCC (2019) can adequately predict CH 4 emissions from cows fed typical Mediterranean diets. However, the use of specific factors for the Mediterranean area, such as DE, improved the accuracy of the models.",no,"The dataset created is for the broader Mediterranean region, not exclusively for Italy. The mentioned 'Italian data set' is not specified as having national coverage.",
10.3390/plants10040743,Design a Database of Italian Vascular Alimurgic Flora (AlimurgITA): Preliminary Results,"Paura, Bruno; Di Marzio, Piera; Salerno, Giovanni; Brugiapaglia, Elisabetta; Bufano, Annarita",2021,"Despite the large number of data published in Italy on WEPs, there is no database providing a complete knowledge framework. Hence the need to design a database of the Italian alimurgic flora: AlimurgITA. Only strictly alimurgic taxa were chosen, excluding casual alien and cultivated ones. The collected data come from an archive of 358 texts (books and scientific articles) from 1918 to date, chosen with appropriate criteria. For each taxon, the part of the plant used, the method of use, the chorotype, the biological form and the regional distribution in Italy were considered. The 1103 taxa of edible flora already entered in the database equal 13.09% of Italian flora. The most widespread family is that of the Asteraceae (20.22%); the most widely used taxa are Cichorium intybus and Borago officinalis. The not homogeneous regional distribution of WEPs (maximum in the south and minimum in the north) has been interpreted. Texts published reached its peak during the 2001-2010 decade. A database for Italian WEPs is important to have a synthesis and to represent the richness and complexity of this knowledge, also in light of its potential for cultural enhancement, as well as its applications for the agri-food system.",yes,"The paper describes the AlimurgITA database, which is designed to cover the entire Italian alimurgic flora, thus having national coverage.",AlimurgITA
10.1007/s10531-015-0994-5,Linking traditional tree-crop landscapes and agro-biodiversity in central Italy using a database of typical and traditional products: a multiple risk assessment through a data mining analysis,"Biasi, Rita; Brunori, Elena; Smiraglia, Daniela; Salvati, Luca",2015,"Understanding the latent relationship between rural landscape and biodiversity conservation is of key importance when aiming to preserve food security, ecosystem services and the quality of the environment. Crop intensification negatively impacted the biodiversity of rural areas and was followed by the adoption of mono-cultural production models. The conservation of traditional agricultural landscapes (TALs) based on traditional land management approaches, ensures the conservation of the ecosystem's complexity and high levels of biodiversity. In Europe, Mediterranean TALs are threatened by a combination of anthropogenic and natural factors. The need to preserve TALs is widely recognized despite the lack of comprehensive information and collective policy strategies. On the other hand, inventories are available for endangered cultivars, typical products and traditional agricultural practices. This study focuses on the relationship between TALs and the use of local varieties/typical products. The analysis will: (i) define, map and characterize the tree-crop based traditional landscapes in one of the Mediterranean regions (Latium, central Italy) through a land-use change detection analysis (1960-2000) and (ii) identify the most endangered TALs based on environmental risk factors, on autochthonous agro-biodiversity at risk of varietal erosion and on traditional products that risk to disappear. Results prove that the most endangered rural landscapes are the ones located on fringe and marginal lands due to climate aridity and soil erosion. The identification of the endangered TALs contributes to constructing more effective strategies for the preservation of agro-biodiversity and natural ecosystem functionality.",no,"The study area is regional (Latium, central Italy), not national.",
10.17660/ActaHortic.2022.1346.70,A pilot study of sensor-based soil moisture assessment for precise irrigation scheduling in apple,"Wenter, A.; Burger, R.; Hafner, H.; Thalheimer, M.",2022,"Irrigation is an essential agronomic practice in intensive apple production. Under the predicted scenario of climate change and increased pressure for sustainability in the future, irrigation is becoming more important. The practical use of soil moisture sensors could support farmers in improving irrigation scheduling. Recent technical advances in wireless communication, such as Long Range Wide Area Networks (LoRaWAN), allow real-time data transfer from field sensors to the user. The management of such sensors is facilitated by their low power requirement and absence of direct on-site data storage via data loggers. The main goal of the pilot study Smart Land South Tyrol was to test the implementation of a system of soil moisture sensors, data transfer by LoRaWAN, and data visualization on a Smartphone Application. The project partners, Research Center Laimburg, Advisory Service Beratungsring, and the company Alperia worked since 2019 together to achieve this goal. A sensor network of 120 soil moisture sensors was established within the apple growing area of South Tyrol near Bolzano, Italy. Data were collected during the growing seasons 2019 and 2020. At the same time, the data flow system from the sensors to the database backend was technically improved. Finally, the technical basis for future DLT/blockchain-based data trails validation has been prepared.",no,"The data was collected in a specific region (South Tyrol), not at a national level.",
10.3390/agronomy11030555,Exploring Climate Change Effects on Vegetation Phenology by MOD13Q1 Data: The Piemonte Region Case Study in the Period 2001-2019,"Sarvia, Filippo; De Petris, Samuele; Borgogno-Mondino, Enrico",2021,"Rising temperature, rainfall, and wind regime changes, increasing of frequency and intensity of extreme events are only some of the effects of climate change affecting the agro-forestry sector. Earth Observation data from satellite missions (often available for free) can certainly support analysis of climate change effects on vegetation, making possible to improve land management in space and time. Within this context, the present work aims at investigating natural and agricultural vegetation, as mapped by Corine Land Cover (CLC) dataset, focusing on phenological metrics trends that can be possibly conditioned by the ongoing climate-change. The study area consists of the entire Piemonte region (NW-Italy). MOD13Q1-v6 dataset from TERRA MODIS mission was used to describe pluri-annual (2001-2019) phenological behavior of vegetation focusing on the following CLC classes: Non-irrigated arable land, Vineyards, Pastures, and Forests. After computing and mapping some phenological metrics as derivable from the interpretation of at-pixel level NDVI (Normalized Difference Vegetation Index) temporal profile, we found that the most significant one was the maximum annual NDVI (MaxNDVI). Consequently, its trend was analyzed at CLC class level for the whole Piemonte region. Natural and semi-natural vegetation classes (Pastures and Forests) were furtherly investigated testing significance of the Percent Total Variation (TV%) of MaxNDVI in the period 2001-2019 for different altitude classes. Results proved that Non-irrigated arable land showed a not significant trend of MaxNDVI; differently, vineyards and forests showed a significant increasing one. Concerning TV%, it was found that it increases with altitude for the Forests CLC class, while it decreases with altitude for the pastures class.",no,"The data sources used (MODIS, Corine Land Cover) are global/European, not exclusively Italian. The study area is also regional (Piemonte).",
10.1016/j.dib.2022.108409,Datasets of harmonized risk assessment of grapevine downy mildew and phenological observations in eight Italian regions (2012-2017),"Bregaglio, Simone; Savian, Francesco; Raparelli, Elisabetta; Morelli, Danilo; Epifani, Rosanna; Fila, Gianni; Manici, Luisa M.",2022,"Phytosanitary bulletins released at weekly interval by eight Italian regional plant protection services in the growing seasons 2012-2017 were used to derive an harmonized dataset of grapevine downy mildew infection risk and phenological observations. The downy mildew infection risk (n = 8816) was classified using a 5-point Likert response item ranging from 'very low' (1) to 'very high' (5) by six independent evaluators with domain expertise in agronomy, phytopathology and agrometeorology. Common criteria have been used in the risk assessment, considering (i) the presence of disease symptoms in field surveys, (ii) the host phenological susceptibility, (iii) the weather forecasts in the next week from the bulletin release date, (iv) the advice to apply a fungicide treatment and (v) the outputs of epidemiological models. The phenological observations are provided as BBCH codes (n = 1689), which have been either transcribed from the phytosanitary bulletins or derived from the narrative description of the visual observation. Phenological data refer to the main early and late grapevine varieties in the eight regions (NUTS-2 administrative unit). Each record is associated with the NUTS-2 and NUTS-3 (31 provinces) administrative unit of reference, to the growing season (2012-2017), and refers to the individual risk assessment by the six evaluators. The dataset is hosted by the Centre for Agriculture and Environment of the Italian Council for Agricultural Research and Economics. These data could be helpful to researchers who develop either grapevine phenological models or process-based epidemiological predictive algorithms in order to refine their calibration and evaluation, as well as being a valuable resource for stakeholders in charge of evaluating the effective implementation of Integrated Pest Management in the decision-making process of public plant protection services in Italy. The dataset is freely available here. (C) 2022 The Authors. Published by Elsevier Inc.",no,"The dataset covers eight Italian regions, which is multi-regional but not national coverage.",
10.1016/j.dib.2021.106809,A grapevine leaves dataset for early detection and classification of esca disease in vineyards through machine learning,"Alessandrini, M.; Rivera, R. Calero Fuentes; Falaschetti, L.; Pau, D.; Tomaselli, V.; Turchetti, C.",2021,"Esca is one of the most common disease that can severely damage grapevine. This disease, if not properly treated in time, is the cause of vegetative stress or death of the attacked plant, with the consequence of losses in production as well as a rising risk of propagation to the closer grapevines. Nowadays, the detection of Esca is carried out manually through visual surveys usually done by agronomists, requiring enormous amount of time. Recently, image processing, computer vision and machine learning methods have been widely adopted for plant diseases classification. These methods can minimize the time spent for anomaly detection ensuring an early detection of Esca disease in grapevine plants that helps in preventing it to spread in the vineyards and in minimizing the financial loss to the wine producers. In this article, an image dataset of grapevine leaves is presented. The dataset holds grapevine leaves images belonging to two classes: unhealthy leaves acquired from plants affected by Esca disease and healthy leaves. The data presented has been collected to be used in a research project jointly developed by the Department of Information Engineering, Polytechnic University of Marche, Ancona, Italy and the STMicroelectronics, Italy, under the cooperation of the Umani Ronchi SPA winery, Osimo, Ancona, Marche, Italy. The dataset could be helpful to researchers who use machine learning and computer vision algorithms to develop applications that help agronomists in early detection of grapevine plant diseases. (C) 2021 Published by Elsevier Inc.",no,"The dataset is collected from a specific local site (a winery in the Marche region), not at a national level.",
10.3897/phytokeys.161.53915,The segetal flora of Italy: an occurrence dataset from releves in winter cereals and allied crop types,"Fanfarillo, Emanuele; Latini, Marta; Iberite, Mauro; Abbate, Giovanna",2020,"The segetal flora of winter crops includes mostly native or archaeophyte annual species that are often strong specialists of their habitats. Threatened by the intensification of agriculture, segetal flora is particularly valuable from a perspective of biodiversity conservation and evolution. Moreover, it contributes to maintain biodiversity in agroecosystems and provides several ecosystem services. The dataset here described was set up to provide the first inventory of the segetal flora of Italian winter cereal crops and allied crop types, the latter including flax and autumn-sown legumes. It includes 24,676 georeferenced occurrence data deriving from 1,240 floristic and phytosociological releves. The data were collected from the greater part of Italian territory, in a temporal range spanning from 1946 to 2018.",yes,"The paper presents a dataset of segetal flora with coverage of the 'greater part of Italian territory', indicating a national scope.",
10.1007/s00484-016-1241-9,Grapevine phenology and climate change in Georgia,"Cola, G.; Failla, O.; Maghradze, D.; Megrelidze, L.; Mariani, L.",2017,"While the climate of Western Europe has been deeply affected by the abrupt climate change that took place in the late '1980s of the twentieth century, a similar signal is detected only few years later, in 1994, in Georgia. Grapevine phenology is deeply influenced by climate and this paper aimed to analyze how phenological timing changed before and after the climatic change of 1994. Availability of thermal resources in the two climatic phases for the five altitudinal belts in the 0-1250-m range was analyzed. A phenological dataset gathered in two experimental sites during the period 2012-2014, and a suitable thermal dataset was used to calibrate a phenological model based on the normal approach and able to describe BBCH phenological stages 61 (beginning of flowering), 71 (fruit set), and 81 (veraison). Calibration was performed for four relevant Georgian varieties (Mtsvane Kakhuri, Rkatsiteli, Ojaleshi, and Saperavi). The model validation was performed on an independent 3-year dataset gathered in Gorizia (Italy). Furthermore, in the case of variety Rkatsiteli, the model was applied to the 1974-2013 thermal time series in order to obtain phenological maps of the Georgian territory. Results show that after the climate change of 1994, Rkatsiteli showed an advance, more relevant at higher altitudes where the whole increase of thermal resource was effectively translated in phenological advance. For instance the average advance of veraison was 5.9 days for 250-500 m asl belt and 18.1 days for 750-1000 m asl). On the other hand, at lower altitudes, phenological advance was depleted by superoptimal temperatures. As a final result, some suggestions for the adaptation of viticultural practices to the current climatic phase are provided.",no,"The main focus and dataset of the study are on Georgia, not Italy.",
10.1002/joc.4606,"Assessment of parallel precipitation measurements networks in Piedmont, Italy","Acquaotta, F.; Fratianni, S.; Venema, V.",2016,"Long historical climate records usually contain non-climatic changes that can influence the observed behaviour of meteorological variables. The availability of parallel measurements offers an ideal occasion to study these discontinuities as they record the same climate. The transition from manual to automatic measurements has been analysed in this study. The dataset has been obtained from two independent climate networks in the Piedmont region, in Northwest Italy. From this dataset, 17 pairs of stations with up to 17 years of overlapping have been identified. On average the overlapping period is 12 years with 8760 daily data matched for a pair of stations. This dataset has proven valuable because it has made it possible to study a set of independently managed pairs of standard-quality stations, while most previous studies in this field analysed data from well-maintained instruments with the same operator, often at meteorological offices. The transition between two networks has highlighted important differences in the amount of precipitation and in the number of rainy days. On average, the automatic network has measured 12% less precipitation and has recorded 9% more rainy days (8 days) per year than the manual network. Both of these differences produce a spurious change in the precipitation of the analysed area, thus showing the importance of having a homogeneous dataset to identify real climate variations.",no,"The dataset used covers the Piedmont region, which is regional, not national coverage.",
