DOI,Title,Authors,Year,Abstract,Include,Reason,Data Source
10.1109/MetroAgriFor55389.2022.9964911,"Use of satellite-based phenometrics, geophysical soil data and a semi-distributed agro-hydrological model for variable-rate irrigation management in a maize farm in northern Italy",A. Mayer; B. Ortuani; M. De Peppo; F. Nutini; A. Crema; M. Boschetti; G. Ragaglini; A. Facchi,2022,"In the most recent agricultural seasons water scarcity problems in many areas of the Po plain had become more frequent; thus, the introduction of irrigation-saving methods and technologies is becoming essential, especially in areas that cannot benefit from a large availability of surface water resources. In the context of precision irrigation, aimed at increasing water and energy productivity at the farm scale by operating a spatial and temporal variable-rate irrigation if needed, agro-hydrological models play a crucial role. In this study, remote-sensed phenometrics and biophysical crop parameters, and delineation of homogeneous management zones through an electromagnetic induction (EMI) sensor, were used to parametrize a semi-distributed mechanistic agro-hydrological model in the case of a 300-ha maize farm located in Brescia (northern Italy). The modelling system was applied to simulate irrigation use in the current situation and in the case of an optimized and variable rate irrigation management. Average results for the period 2016–2020 showed a water and energy saving of about 20% in the case of the optimized irrigation management, confirmed by savings achieved in a pilot pivot in which the modelling procedure was used in 2021 to support the irrigation scheduling in combination with 7-days weather forecast data.",no,"The study is conducted on a single farm in northern Italy, which is local coverage, not the required national coverage.",
10.1109/MetroAgriFor50201.2020.9277599,Future rainfall scenarios for the assessment of water availability in Italy,R. Padulano; G. F. C. Lama; G. Rianna; M. Santini; M. Mancini; M. Stojiljkovic,2020,"This research aims at understanding and analyzing the possible effect of climate change on the seasonal rainfall regime over Italy. First, rainfall patterns are identified by applying a clustering procedure based on the Self-Organizing Map, by adopting and comparing the results of different gridded datasets describing current climate (1981-2010). Second, for the identified clusters the impact of climate change in the near (2021-2050) and the far future (2051-2080) is assessed by employing an ensemble of bias-adjusted EUROCORDEX climate projections under the Representative Concentration Pathways (RCP) 2.6, 4.5 and 8.5. The results of this study show that, for the considered models’ ensemble, a significant decrease in cumulative rainfall values should be expected in the future, reflecting in a decrease in monthly values across all the seasons.",no,"The data source mentioned, EUROCORDEX, is a European-level dataset, not one with exclusively Italian coverage.",
10.1109/IGARSS.2015.7326063,Crop mapping applications at scale: Using Google Earth Engine to enable global crop area and status monitoring using free and open data sources,G. Lemoine; O. Léo,2015,"The confluence of rapidly growing streams of “free and open” satellite imagery at 10-30 m spatial resolution, expending libraries of sophisticated open source software components for geospatial data processing and the increase in publicly available open data sets is driving major changes in agricultural monitoring activities. In the next years, we can expect a scale step in derived crop area and status information at parcel level from the combined use of global sensors such as Landsat-8, Sentinel 1 and 2. In order to handle the unprecedented flow of such data into value adding agricultural mapping and monitoring applications, novel approaches need to be developed to ensure a globally consistent use in a “knowledge inference” context in support of, for instance, food security analysis. We demonstrate the use of Google Earth Engine (GEE) as a prototype environment that could possibly support such a context with 3 different examples.",no,"The abstract explicitly states the data sources and monitoring are for global purposes, which violates the Italian-only coverage criterion.",
10.1109/MetroAgriFor55389.2022.9964826,Measuring the USLE soil erodibility factor in the unit plots of Sparacia (southern Italy) experimental area,V. Bagarello; V. Ferro; V. Pampalone,2022,"The Universal Soil Loss Equation (USLE) is still widely used to predict soil loss by water erosion and to establish soil conservation measures. In this model, the soil erodibility factor $K$ accounts for the susceptibility of the soil to be eroded due to the detachment and transport processes operated by the erosive agents. According to the USLE scheme, the $K$ factor should be measured on unit plots, i.e., bare plots of given length (22 m) and steepness (9%) tilled along the maximum slope direction, but there is little evidence that there ever existed an actual unit plot between the plots used to develop the USLE. Given the difficulty in collecting sufficient data to adequately measure $K$., the nomograph method was early developed to allow estimation of $K$ based on standard soil properties. First, in this investigation the soil erodibility factor was experimentally determined for the clay soil of the Sparacia (Sicily) experimental station, based on the available measurements collected in two unit plots. Although a limited database was available for this analysis, a very low value (0.0038 t ha h ha−1 MJ−1 mm−1) was determined, which was an order of magnitude lower than the nomograph value. Then, the values of the plot steepness factor $S$ were determined using soil loss measurements collected on plots varying in steepness from 9 to 26% and resulted higher than the estimated values by a well-known literature expression. Finally, the plot length factor $L$ resulted independent of the plot length and equal to one. The former result was explained by the different flow transport capacity in the unit plot and plot with increased steepness, while the result of a constant length factor was supported by other experimental investigations.",no,"The data was collected at a specific experimental area in southern Italy, which constitutes local, not national, coverage.",
10.1109/MetroAgriFor.2019.8909219,2D and 3D data fusion for crop monitoring in precision agriculture,L. Comba; A. Biglia; D. R. Aimonino; P. Barge; C. Tortia; P. Gay,2019,"Addressing the intrinsic variability within vineyards is a key factor to perform precision viticulture management. To this aim, new and more reliable methods for vineyard monitoring purposes must be defined. The introduction of Unmanned Aerial Vehicle (UAV) airborne sensors makes available a considerable amount of data with very high resolution, in terms of both spatial and temporal dimension. In this work, a data fusion approach for vigour characterization in vineyards is presented, which exploits the information provided by 2D multispectral aerial imagery, 3D point cloud crop models and aerial thermal imagery. A crucial phase of the procedure is the proper management of data provided by several sources, to achieve high consistency of the obtained huge dataset. The enhanced effectiveness of the proposed method to classify vines in different vigour classes exploiting multi source data was proved by an experimental campaign, considering 30 portions of vine rows, each made by 8 vines. Results showed that the error of the discriminant analysis using data fusion reach an improvement ranging from 67% to 90% with respect to a single data source, with a misclassification error rate of 3%.",no,"The abstract does not specify the geographical location of the experimental campaign, failing to meet the Italian national coverage criterion.",
10.1109/MetroAgriFor52389.2021.9628717,"Improving accuracy and efficiency in plant detection on a novel, benchmarking real-world dataset",L. Ohnemüller; A. Briassouli,2021,"Detecting plants in images is central in precision agriculture, but can be challenging due to their small size, similarities in appearance, varying lighting and environmental conditions. Moreover, computational capacity in real-world settings may be limited. This work examines how accurate, computationally efficient real-time plant detection can be achieved on the large and varied benchmarking Open Plant Phenotyping Database, by building upon the State-of-the-Art (SoA) Scaled YOLO v4 real-time object detection model. The effect of pre-processing, namely cropping unnecessary information and increasing contrast, is examined and experimentally shown to improve both accuracy and efficiency. Transfer learning is also leveraged for the deployment of Scaled YOLO v4, using pre-trained weights from the MS COCO data set, and shown to lead to a moderate improvement in accuracy. The proposed final model results in approximately 10% higher accuracy than the existing baseline model, on a representative subset of about half of images in the Open Plant Phenotyping Database. Experiments show that plant detection accuracy is improved for most well represented samples, with errors appearing in particularly challenging cases or caused by data imbalance. This shows the proposed method has significant potential for highly accurate and computationally efficient plant detection in real-world environments.",no,"The datasets used, Open Plant Phenotyping Database and MS COCO, are international and not exclusively Italian in coverage.",
10.1109/MetroAgriFor58484.2023.10424409,Enhancing precision agriculture through cyber-physical systems: a functional monitoring platform as decision support tool,E. S. Picchiotti; S. Krik; P. Ibba; P. Tosato; A. Altana; M. Valt; A. Gaiardo; L. Petti,2023,"The continuous advances in the area of cyber-physical systems (CPSs) have led to the improvement of various fields, including agriculture. In this sector, high-performance platforms based on sensors and actuators are becoming key components to allow real-time monitoring of the physiological health status of plants. To this end, the aim of this research is to develop a functional and high-efficient CPS to monitor plants’ status using different key indicators such as normalized difference vegetation index (NDVI), volatile organic compounds (VOCs) and nitrogenous oxide (Nox) emissions, combined with environmental parameters such as temperature, air relative humidity, and soil moisture. In particular, in this paper, the potential of the platform is demonstrated by monitoring the environmental conditions and estimating the stress condition of two tomato plants in a greenhouse.",no,"The data is generated from a small-scale experiment on two plants in a greenhouse, which does not provide national coverage.",
10.1109/MetroAgriFor58484.2023.10424133,Data integration of Sentinel-1 and Sentinel-2 for evaluating vegetation biomass and water status,S. Pilia; G. Fontanelli; L. Santurri; G. Ramat; F. Baroni; E. Santi; A. Lapini; S. Pettinato; S. Paloscia,2023,"The integration of microwave and multispectral data is an emerging technique allowing frequent monitoring of the vegetation biomass and health status. This study aims at integrating Sentinel-1 (S-1) and Sentinel-2 (S-2) acquisitions for estimating the biomass and assessing the water status of agricultural vegetation. The proposed method has been developed and tested on an agricultural area located in Tuscany, central Italy, by considering the S-1 and S-2 acquisitions collected during the summer season of 2022 on a grain sorghum plot. The method combines vegetation volumetric water content $(m_{v})$ estimated from SAR data and optical/infrared vegetation indexes, in particular NDRE which presented the best correlation with the in-situ PRI measurements. The results show a relationship and trend between NDRE and $m_{v}$, although for a limited dataset.",no,"The study area is a local agricultural plot in Tuscany, which does not meet the national coverage requirement.",
10.1109/IGARSS.2015.7326071,Rice monitoring using SAR and optical data in Northern Italy,G. Fontanelli; D. Stroppiana; R. Azar; L. Busetto; M. Boschetti; L. Gatti; F. Collivignarelli; M. Barbieri; F. Holecz,2015,This paper describes a rice mapping and growth monitoring project carried out using both optical and SAR data on an agricultural land area in northern Italy. The approach implemented for mapping rice area is based on synthetic features derived from both the optical and SAR C-band multi-temporal dataset and a rule-based algorithm applied on a pixel basis. SAR X-band data were used improving winter crops recognition. Seasonal dynamics were used to identify rice growing season for regression analysis between SAR backscatter and vegetation parameters. Rice green LAI maps have been produced using the equation found during this analysis between C-band HH pol. backscatter and rice LAI.,no,"The study focuses on an agricultural area in northern Italy, which is regional, not national, coverage.",
10.1109/MetroAgriFor63043.2024.10948820,A Data Collection Framework for Precision Agriculture: Addressing Data Gaps and Overlapping Areas with IoT and Artificial Intelligence,G. Narang; A. Galdelli; R. Pietrini; F. Solfanelli; A. Mancini,2024,"The integration of sensor technology and IoT in precision agriculture has significantly improved farm operations. These technologies enable farmers to monitor crop conditions, soil moisture, and equipment performance in real-time, leading to more efficient practices. However, challenges such as missing data due to low network connectivity in farming areas and inefficiencies due to resource overuse during field operations still persist. This paper addresses these critical issues by presenting and implementing a comprehensive data collection mechanism using IoT architecture and sensors installed on farm machinery, capturing key metrics in real-time using serverless cloud technology. This data helps optimize field coverage and minimize redundant work. We further address the issue of missing data incorporating artificial intelligence-based Bidirectional Recurrent Imputation for Time Series (BRITS) model. When considering random missing data, the model successfully imputes the data evaluated at a Mean Absolute Error (MAE) of 0.4228 m, Mean Square Error (MSE) of $0.4374\ \mathrm{m}^{2}$, Root Mean Squared Error (RMSE) of 0.6614 m, and Mean Relative Error (MRE) of 0.1063. Further, we demonstrate that the BRITS model improves the quality and reliability of sensor-generated agricultural data. Moreover, overlapping areas in the monitored field highlight the necessity of optimizing tractor paths.",no,"The abstract does not specify the geographical location or coverage of the data collection, so it cannot be confirmed to be exclusively Italian.",
10.1109/MetroAgriFor55389.2022.9964755,Evaluation of remotely-sensed evapotranspiration datasets at different spatial and temporal scales at forest and grassland sites in Italy,D. De Santis; C. D'Amato; P. Bartkowiak; S. Azimi; M. Castelli; R. Rigon; C. Massari,2022,"Remote sensing measurements offer great potential to quantify evapotranspiration (ET) more accurately. This work assesses several remotely-sensed ET datasets at high, medium and coarse scale through a comparison with eddy covariance (EC) measurements. In particular, daily retrievals obtained from the Sen-ET model and the ECOSTRESS ET product, both having resolutions of tens of meters, were considered. In addition, 3-km daily ET estimates derived from SEVIRI were analyzed, together with 8-day MODIS ET composites at 500-m spatial resolution. The remotely-sensed actual ET retrievals at medium and coarse scale were compared with EC observations at five forest and grassland sites over different climate zones in Italy. Additionally, for one of these sites (Monte Bondone), the high-resolution ET estimates within the EC footprint were also evaluated. Sen-ET retrievals demonstrated a remarkable ability to describe EC latent heat fluxes (e.g., Pearson correlation coefficient, R, equal to 0.83, and unbiased root-mean-square-difference, ubRMSD, equal to 0.85 mm/day), and therefore great potential for producing high-resolution ET estimates, while ECOSTRESS data were less performant (e.g., R = 0.46, and $\boldsymbol{ubRMSD}=1.65\boldsymbol{mm}/\text{day})$. Despite the spatial differences between EC footprint size and the medium along with coarse scale of remotely-sensed datasets, the latter both showed a good agreement with the measured EC fluxes. The SEVIRI ET, in particular, proved to be significantly suitable for the ET description also at a local scale (at daily time step, average R = 0.84, and average $\boldsymbol{u b R M S D=\mathbf0. 8 3}$ mm/day over the study sites), despite a tendency to underestimate in-situ measurements (negative biases ranging between 0.2 and 0.85 mm/day were observed). This study contributes to the topic of evaluating specific remotely-sensed ET datasets under different conditions. The obtained results generally confirm the value of satellite-derived retrievals for ET estimate and monitoring, as well as their potential to improve ET modeling.",no,"The study evaluates data at specific sites in Italy, not providing national coverage. Furthermore, the underlying datasets (ECOSTRESS, SEVIRI, MODIS) are global or continental.",
10.1109/ICDMW51313.2020.00130,Data Management System based on Blockchain Technology for Agricultural Supply Chain,C. Yang; Z. Sun,2020,"In order to better realize agricultural informatization, a data management system for agricultural supply chain, which has the characteristics of safe, credible, stable, traceable, information-sharing, and large-throughput, is needed to construct. To date, the information management method for China's agricultural supply chain is usually stored in a centralized database and file system, with weak information management capabilities, leading to problems such as theft, tampering, deletion, and inconsistencies. In light of these problems, we introduce blockchain technology which is a cutting-edge technology in digital finance and has developed rapidly. This paper proposes a data management system based on blockchain technology and affords efficient data extraction, management and access control for heterogeneous forms of data across the agricultural supply chain. The data management system includes four credible data management platforms: agricultural production information, recording transportation information, farmer-consumer transaction information, and consumer credit information. It also can add more platforms according to later needs and combine an interstellar distributed file system and smart contract technology, making it possible to conduct information security research throughout the agricultural supply chain. The proposed system effectively protects information about supply chain activities including agricultural product production, warehousing, transportation, distribution, and sales. It implements seamless connection between agricultural product production and marketing, enabling the transforming and upgrading of agriculture, thereby helping farmers increase their income and eliminate poverty.",no,"The abstract specifies the context as 'China's agricultural supply chain', not Italy.",
10.1109/BigData59044.2023.10386276,Privacy-Preserving Data Sharing in Agriculture: Enforcing Policy Rules for Secure and Confidential Data Synthesis,A. Kotal; L. Elluri; D. Gupta; V. Mandalapu; A. Joshi,2023,"Big Data empowers the farming community with the information needed to optimize resource usage, increase productivity, and enhance the sustainability of agricultural practices. The use of Big Data in farming requires the collection and analysis of data from various sources such as sensors, satellites, and farmer surveys. While Big Data can provide the farming community with valuable insights and improve efficiency, there is significant concern regarding the security of this data as well as the privacy of the participants. Privacy regulations, such as the European Union’s General Data Protection Regulation (GDPR), the EU Code of Conduct on agricultural data sharing by contractual agreement, and the proposed EU AI law, have been created to address the issue of data privacy and provide specific guidelines on when and how data can be shared between organizations. To make confidential agricultural data widely available for Big Data analysis without violating the privacy of the data subjects, we consider privacy-preserving methods of data sharing in agriculture. Synthetic data that retains the statistical properties of the original data but does not include actual individuals’ information provides a suitable alternative to sharing sensitive datasets. Deep learning-based synthetic data generation has been proposed for privacy-preserving data sharing. However, there is a lack of compliance with documented data privacy policies in such privacy-preserving efforts. In this study, we propose a novel framework for enforcing privacy policy rules in privacy-preserving data generation algorithms. We explore several available agricultural codes of conduct, extract knowledge related to the privacy constraints in data, and use the extracted knowledge to define privacy bounds in a privacy-preserving generative model. We use our framework to generate synthetic agricultural data and present experimental results that demonstrate the utility of the synthetic dataset in downstream tasks. We also show that our framework can evade potential threats, such as re-identification and linkage issues, and secure data based on applicable regulatory policy rules.",no,"The abstract discusses data in a general context, mentioning European regulations but not specifying that the data has exclusively Italian national coverage.",
10.1109/MetroAgriFor58484.2023.10424077,Can soil organic carbon in long–term experiments be detected using Vis-NIR spectroscopy?,R. Barbetti; F. Palazzi; P. M. Chiarabaglio; C. L. Fondon; D. Rizza; A. Rocci; C. Grignani; L. Zavattaro; B. Moretti; M. Fantappié; S. Monaco,2023,"The determination of soil organic carbon (SOC) stock and its evolution over time is important for understanding the cycling of carbon in soils, and its relationship with agricultural practices and agro-environmental conditions to develop more sustainable management practices. Moreover, this issue is of great importance in the development of monitoring, reporting, and verification (MRV) systems as part of climate change mitigation measures affecting the agricultural sector. In this context, the present study aims to investigate the reliability of visible and near-infrared (Vis-NIR) spectroscopy as a fast method to determine and monitor the SOC content in an MRV system framework. To that aim, soils from a Long-term field experiment (LTE), located in northern Italy and comparing various maize-based forage systems with contrasting residues and fertilization management was used as a case study. Three sampling campaigns (i.e. 2003, 2012, and 2018) were utilized for a total of 162 soil samples collected in the LTE (54 each). Soil samples archived after each campaign were retrieved and scanned using a Vis-NIR spectrometer to create a site-specific soil spectral library (Site-SSL). Aiming to implement a local prediction model, the 54 soil samples and spectra collected in 2003 were used as a training data set to estimate the SOC of the soil samples collected in 2012 and 2018 (108 in total). In practice, 2003 soil survey represented the time zero reference system. Concurrently, a second prediction model was performed from a regional soil sample archive (Reg-SSL). This is a dataset containing 122 soil samples and spectra collected in alluvial soils from the Po Plain, in the same pedo-landscape of the LTE. The Reg-SSL was merged with the 2003 Site-SSL to implement a regional prediction model. The objective of this activity was to compare the SOC estimations for 2012 and 2018 obtained with both Site-SSL and Reg-SSL models. In addition, three strategies were compared, including Random Forest (RF), Cubist (CU), and Memory based learning (MBL) on Site-SSL and Reg-SSL models (totally, six models were created). We also carried out a sensitivity analysis about the influence of training sample size on the accuracy of different models. Results revealed high correlations between measured and predicted values and for this kind of application, the best results were identified for the MBL model and the Site-SSL dataset. This exercise pointed out that Vis-NIR spectral libraries could be used for detecting changes in SOC. In addition, comparing the use of regional and site-specific libraries for SOC estimation, we confirmed that the accuracy of the Reg-SSL model, although more stable, was lower than that of Site-SSL. A sample size of N=40 samples resulted large enough for building a site-specific spectral library.",no,"The data comes from a specific long-term experiment and a regional archive (Po Plain) in northern Italy, which is not national coverage.",
