DOI,Title,Authors,Year,Abstract,Include,Reason,Data Source
10.1109/BigMM55396.2022.00020,Explainable AI at Work! What Can It Do for Smart Agriculture?,A. Cartolano; A. Cuzzocrea; G. Pilato; G. M. Grasso,2022,"Explainable AI (XAI) is gaining the momentum, at now. While the idea is to apply it in different scenarios, including medicine, business analytics, genomics computing and so forth, in this paper we focus the attention on another emerging case, represented by so called smart agricolture. In this paper, we propose the application of some well-known XAI tools on top of the Crop Recommendation dataset. Our research efforts also involve the sensitivity analysis of retrieved results.",no,The 'Crop Recommendation dataset' is a generic public dataset and does not have exclusively Italian national coverage.,Crop Recommendation dataset
10.1109/MetroAgriFor58484.2023.10424103,Cattle Face Recognition Using Deep Transfer Learning Techniques,A. Ruchay; I. Akulshin; V. Kolpakov; K. Dzhulamanov; H. Guo; A. Pezzuolo,2023,"In this research, a new approach has been proposed for cattle face recognition using RGB images based on deep convolutional neural network. Nowadays, biometric identification of animals is a major problem in computer vision and livestock sector. In this research, all RGB images were preprocessed to improve recognition reliability. A deep learning model was carried out using additional data augmentation methods and fine neural network tuning. The pre-trained neural networks chosen were VGGFACE and VGGFACE2. As a result, the VGGFACE2 pre-trained neural network was chosen to identify cattle faces with 97.1% accuracy.",no,The abstract does not specify the geographical origin of the cattle images used for the research.,VGGFACE;VGGFACE2
10.1109/CASE59546.2024.10711594,Self-Supervised Data Generation for Precision Agriculture: Blending Simulated Environments with Real Imagery,L. Saraceni; I. M. Motoi; D. Nardi; T. A. Ciarfuglia,2024,"In precision agriculture, the scarcity of labeled data and significant covariate shifts pose unique challenges for training machine learning models. This scarcity is particularly problematic due to the dynamic nature of the environment and the evolving appearance of agricultural subjects as living things. We propose a novel system for generating realistic synthetic data to address these challenges. Utilizing a vineyard simulator based on the Unity engine, our system employs a cut-and-paste technique with geometrical consistency considerations to produce accurate photo-realistic images and labels from synthetic environments to train detection algorithms. This approach generates diverse data samples across various viewpoints and lighting conditions. We demonstrate considerable performance improvements in training a state-of-the-art detector by applying our method to table grapes cultivation. The combination of techniques can be easily automated, an increasingly important consideration for adoption in agricultural practice.",no,The paper is about generating synthetic data and does not mention any dataset with exclusively Italian national coverage.,
10.1109/CAFE58535.2023.10291622,Plant Disease Detection: Electronic System Design Empowered with Artificial Intelligence,J. Wu; U. Dar; M. H. Anisi; V. Abolghasemi; C. N. Wilkin; A. I. Wilkin,2023,"Today, plant diseases have become a major threat to the development of agriculture and forestry, not only affecting the normal growth of plants but also causing food safety problems. Hence, it is necessary to identify and detect disease regions and types of plants as quickly as possible. We have developed a plant monitoring system consisting of sensors and cameras for early detection of plant diseases. First, we create a dataset based on the data collected from the strawberry plants and then use our dataset as well as some well-established public datasets to evaluate and compare the recent deep learning-based plant disease detection studies. Finally, we propose a solution to identify plant diseases using a ResNet model with a novel variable learning rate which changes during the testing phase. We have explored different learning rates and found out that the highest accuracy for classification of healthy and unhealthy strawberry plants is obtained with the learning rate of 0.01 at 99.77%. Experimental results confirm the effectiveness of the proposed system in achieving high disease detection accuracy.",no,"The abstract mentions creating a new dataset and using public ones, but provides no information on their geographical coverage to confirm it is exclusively Italian.",
10.1109/IGARSS.2015.7326455,"Assessing land use induced disturbance to vegetation cover in the upper Molopo catchment, South Africa, using Landsat images",A. Turyahikayo,2015,"Historical images in archive can serve as data record for quantifying disturbance to vegetation cover. This study used the post-classification comparison change detection technique on a Landsat (TM, ETM+, OLI) image dataset (1989, 1996, 2005, 2013) in assessing long-term effects of land use factors on the vegetation cover of the upper Molopo river catchment, South Africa. The Normalized Difference Vegetation Index (NDVI) enhanced vegetation. Based on field data, three NDVI value classes that indicated the vegetation density could then be identified: high (NDVI > 0.5.), medium (NDVI 0.3-0.5), and low (NDVI <; 0.3). These NDVI classes were used in a supervised Maximum Likelihood Classification (MLC) of the respective images. Change in area of cover by the classes indicated a reduction in medium density vegetation, particularly within 5 kilometers of human settlements. There was a statistically significant correlation between human population and medium density vegetation (r = -0.960; P <; 0.01).",no,"The study area is explicitly stated as the 'upper Molopo catchment, South Africa', not Italy.",Landsat
10.1109/ISSE63315.2024.10741144,System reliability of fault-tolerant Wireless Sensor Network for precision agriculture,G. Patrizi; A. Bartolini; L. Ciani; M. Catelani,2024,"Wireless Sensor Networks (WSNs) are smart devices that are used to monitor multiple physical parameters of a complex system, plant, or process. Most of the time, WSNs need to be installed in harsh outdoor environments, impacting their overall reliability and availability. This paper investigates the influence of redundancy and fault tolerant architecture on the reliability of a WSN used in precision agriculture. Specifically, it investigates the design and deployment of a low-cost, self-powered WSN, assessing its reliability considering the real environmental conditions in which the systems need to operate, as well as taking into account the actual node placements in the field. The reliability of all the different wireless node and general subsystems has been studied using reliability prediction handbooks, and then combined by means of dedicated Reliability Block Diagrams. Furthermore, the estimation of the battery End-Of-Life based on a large degradation dataset has been considered and merged inside the reliability analysis in order to improve the accuracy of the system’s reliability.",no,The abstract mentions a 'large degradation dataset' without specifying any link to Italian agriculture or national coverage.,
10.1109/SMARTCOMP50058.2020.00027,Quantitative Analysis of Deep Leaf: a Plant Disease Detector on the Smart Edge,F. de Vita; G. Nocera; D. Bruneo; V. Tomaselli; D. Giacalone; S. K. Das,2020,"Diagnosis of plant health conditions is gaining significant attention in smart agriculture. Timely recognition of early symptoms of a disease can help avoid the spread of epidemics on the plantations. In this regard, most of the existing solutions use some AI techniques on smart edge devices (IoTs or intelligent Cyber Physical Systems), typically equipped with a hardware like sensors and actuators. However, the resource constraints on such devices like energy (power), memory and computation capability, make the execution of complex operations and AI algorithms (neural network models) for disease detection quite challenging. To this end, compression and quantization techniques offer viable solutions to reduce the memory footprint of neural networks while maximizing performance on the constrained devices. In this paper, we realized a real intelligent CPS on top of which we implemented an AI application, called Deep Leaf running on a microcontroller of the STM32 family, to detect coffee plant diseases with the help of a Quantized Convolutional Neural Network (Q-CNN) model. We present a quantitative analysis of Deep Leaf by comparing five different deep learning models: a 32-bit floating point model, a compressed model, and three different types of quantized models exhibiting differences in terms of accuracy, memory utilization, average inference time, and energy consumption. Experimental results show that the proposed Deep Leaf detector is able to correctly classify the plant health condition with an accuracy of 96%, thus demonstrating the feasibility of our approach on a Smart Edge platform.",no,"The abstract does not mention any specific dataset, and the subject (coffee plants) is not typically associated with Italian national-level agriculture.",
10.1109/IPAS55744.2022.10052855,White Flies and Black Aphids Detection in Field Vegetable Crops using Deep Learning,N. Giakoumoglou; E. M. Pechlivani; N. Katsoulas; D. Tzovaras,2022,"Digital image processing for the early detection of plant pests as insects in vegetable crops is essential for plant's yield and quality. In recent years, deep learning has made strides in the digital image processing, opening up new possibilities for pest monitoring. In this paper, state-of-the-art deep learning models are presented to detect common insect pests in vegetable cultivation named whiteflies and black aphids. Due to the absence of data sources addressing the aforementioned insect pests, adhesive traps for catching the target insects were used for the creation of an annotated image dataset. In total 225 images were collected, and 5904 insect instances were labelled by expert agronomists. This dataset faces many challenges such as the tiny size of objects, occlusions and resemblance. Object detection models were used like YOLOv3, YOLOv5, Faster R-CNN, Mask R-CNN, and RetinaNet as baseline algorithms for benchmark experiments. For achieving accurate results, data augmentation was used. This study has addressed these challenges by applying deep learning models which are able to deal with tiny object detection ascribed to very small insect size. The experiment results exhibit a mean Average Precision (mAP) of 75%. Dataset is available for download at https://zenodo.org/record/7139220",no,"The abstract describes the creation of a new dataset, but its geographical origin is not specified as being Italy.",
10.1109/IGARSS.2015.7327029,Spatial and temporal characterization of agricultural crop volumes by means of polarimetric SAR tomographyatc-band,H. Joerg; M. Pardini; I. Hajnsek,2015,"In this paper, agricultural crop volumes are analysed using (polarimetric) tomographic SAR methodologies. A procedure for the separation of the ground and volume multibaseline coherences is proposed. This separation is used in particular to investigate the polarization dependency of the vegetation vertical structure in order to get first insights about orientation effects. This analysis has been carried out for different crops and on different development stages. The presented results have been obtained by processing a multibaseline fully polarimetric data set purposely acquired at C-band by the DLR's airborne sensor F-SAR in 2014.",no,The abstract does not specify the geographical location where the multibaseline dataset was acquired.,
10.1109/IGARSS.2015.7326737,CO-POLAR SAR data classification as a tool for real time paddy-rice monitoring,Ç. Küçük; G. T. Kaya; E. Erten,2015,"The crop phenology retrieval on precision agriculture has been an important research area with the increasing demand on crops. Remotely sensed Synthetic Aperture Radar (SAR) data provides a simple possibility for automatic monitoring of agricultural fields due to the its inherit all-weather monitoring capability. Most of the studies rely on morphology based modelling of the electromagnetic backscattering which requires Monte Carlo simulations. In this paper, instead of modelling the backscattering of the signals for monitoring the crop fields, a classification scheme was implemented on the data acquired by TerraSAR-X by using the features extracted from backscattering coefficients with the machine learning algorithms which are Support Vector Machines, k-Nearest Neighbor and Regression Tree.",no,The abstract mentions data from the TerraSAR-X satellite but does not specify the geographical area of interest.,TerraSAR-X
10.1109/IGARSS.2015.7326956,A benchmark for scene classification of high spatial resolution remote sensing imagery,J. Hu; T. Jiang; X. Tong; G. -S. Xia; L. Zhang,2015,"Scene classification for high-resolution remotely sensed imagery have been widely investigated in recent years. However, there is few public, widely accepted and large scale dataset for benchmarking different methods. This paper presents a new and large dataset consisting of 5000 high-resolution remote sensing images which is manually labeled in 20 semantic classes for scene classification. Each class includes more than 200 image samples with different appearances. Some classic classification algorithms are compared on this dataset. To our knowledge, this work is the first time to give a public benchmark dataset at this size on the problem of scene classification in high-resolution remote sensing imagery, and give comparative results and analysis of various classic classification algorithms.",no,The paper presents a new benchmark dataset for remote sensing imagery without specifying any exclusively Italian national coverage.,
10.1109/JSTARS.2024.3375624,Vegetation Biomass and Nitrogen Content Estimation Using Ensembles: Regression and Active Learning Strategies for Field Sampling Reduction,D. Amitrano; G. Candiani; L. Cicala; M. De Mizio; F. Tufano,2024,"Optimization of agricultural practices is crucial to ensure high and sustainable food production. In this regard, hyperspectral remote sensing demonstrated its usefulness in the building of models able to predict several vegetation parameters. The effort, in terms of time and costs, of a remote sensing campaign depends on both the instruments to be exploited and the number of samples to be acquired for model calibration. Therefore, the reduction of field activities is important to limit monitoring costs. The purpose of this work is to demonstrate that the combination of appropriate active learning strategies and regression models can dramatically reduce the field work with negligible degradation of model prediction performance. This has been assessed by processing two different datasets. In the first experiment, estimated ryegrass biomass and nitrogen content resulted in average root-mean-square error (RMSE) values of 0.17 t/ha and 3.22 kg/ha against the best literature values, on the same dataset, of 0.20 t/ha and 4.68 kg/ha. In the second test, the estimation of maize biomass and nitrogen content with a reduced calibration dataset provided, respectively, an RMSE of 0.65 t/ha and 11.1 kg/ha against a reference value of 7.1 kg/ha concerning the estimation of nitrogen content. Depending on the settings, the developed methodology provides results comparable with the literature or negligibly degraded, despite a reduction of the calibration dataset up to 80%.",no,The abstract mentions two datasets (ryegrass and maize) but does not specify their geographical origin.,
10.1109/IGARSS47720.2021.9554878,Estimation of Field Scale Topsoil Properties of Agronomic Interest from Prisma Imaging Spectrometer Data,R. Casa; M. Tolomio; N. Mzid; S. Pignatti; S. Pascucci,2021,"On the 22 March 2019, the Italian Space Agency (ASI) launched the PRISMA satellite, having onboard a hyperspectral imager covering the 400–2500 nm range with 234 spectral bands and about 10 nm of bandwidth. The ground spatial resolution is 30 m, plus a panchromatic camera with 5 m spatial resolution. One of the potential application areas of this scientific mission is for precision agriculture applications, among which the mapping of field-scale variability of topsoil properties is of particular interest. PRISMA clear-sky hyperspectral images were acquired in autumn and spring 2019 over two agricultural areas, Maccarese (Central Italy), and Pignola (Southern Italy). An intensive soil sampling campaign was performed, using a ground sampling scheme adapted to PRISMA spatial 30 and 5 m (PAN) resolutions, in the fields where bare soil was exposed at the satellite acquisition dates. Soil texture (clay, silt, sand) and soil organic carbon (SOC) for the collected soil samples were then determined in the laboratory. The dataset was then used to test calibration and validation of PLS (Partial Least Squares) and Random Forest (RF) regressions, developed using PRISMA surface reflectance data. To this aim, several pre-treatment tests were performed. The results show that good results could be obtained especially for clay estimation.",no,"The data covers two specific agricultural areas in Italy, which is local/regional coverage, not the required national level coverage.",PRISMA
10.1109/ACCESS.2024.3451627,GreenLand: A Secure Land Registration Scheme for Blockchain and AI-Enabled Agriculture Industry 5.0,F. Naguji; N. Kumar Jadav; S. Tanwar; G. Pau; G. Sharma; F. Alqahtani; A. Tolba,2024,"The main aim of the proposed system is to facilitate secure and protected land registry in the domain of agriculture Industry 5.0. Considering the outlook of issues associated with it, we considered the blockchain and AI-based technology to fulfill the purpose of secure land registry. Establishing and confirming land ownership is essential for the land registry system in ensuring the protection of ownership rights, particularly crucial in the contexts of agriculture and Industry 5.0. In these sectors, land serves as a crucial resource for sustainable development and industrial innovation. Most of the existing works rely on legacy and centralized system to store land records; which result in high incidences of forgery and fraud. Therefore, maintaining a robust land registry system is essential to fostering economic investments, promoting green practices, and facilitating equitable access to land resources in agriculture and Industry 5.0 ecosystem. We proposed an AI and blockchain-enabled land registry system for agriculture and industry 5.0 that offers a more reliable, transparent, and efficient solution to the challenges of lack of transparency, data tampering, and inefficiency, which can result in disputes, fraudulent claims, and a lack of trust during the land registry. AI models, such as logistic regression (LR), support vector machine (SVM), random forest (RF), extreme gradient boosting (XGB), and light gradient boosting machine (LGBM), are employed to classify the fraud and non-fraud land data. Only the non-fraud land data is forwarded into the blockchain network, thereby reducing the computational overhead of the proposed land registry system. In the blockchain network, we designed various smart contracts that validate the land data with unparalleled efficiency and security. Further, the slither solidity source analyzer tool is used for smart contract vulnerability assessment. After the assessment, the smart contract is deployed using the Sepolia test network. The non-fraudulent land data is redirected to the interplanetary file system (IPFS) that stores the original data and forwards the associated hash into the blockchain’s immutable ledger. The entire proposed system is evaluated with different performance parameters, such as AI statistical measures including accuracy, ROC, log-loss score, blockchain scalability comparison, gas cost utilization, and bandwidth utilization. Furthermore, the vulnerability assessment of the smart contract is analyzed using Slither to highlight the working of proposed system without any vulnerabilities. The proposed blockchain and AI-based land registry system ensure a secure and intelligent pipeline to combat against land forgery activities.",no,The abstract describes a general system for land registry and does not mention any dataset with exclusively Italian national coverage.,
10.1109/MetroAgriFor52389.2021.9628547,Live weight prediction of cattle using deep image regression,A. Ruchay; K. Dorofeev; V. Kalschikov; V. Kolpakov; K. Dzhulamanov; H. Guo,2021,"The traditional linear regression algorithm is used to predict the live weight of livestock. However, this traditional method is inadequate for accurate prediction. Recently, a few researchers have successfully applied various machine learning algorithms for predicting the live body weight using livestock morphological measures. We investigate deep learning methods for developing a live weight prediction model based on image regression in this study. We use only RGB images and depth maps for predicting the live cattle weight. The best model for our study is the proposed model with MAPE 9.1% using the RGB images and the depth maps. We have shown results on real-world datasets that demonstrate that the proposed model can reach levels of weight measurement accuracy comparable to those obtained by traditional weighting.",no,The abstract mentions 'real-world datasets' of cattle images but does not specify their geographical origin.,
10.1109/BigData59044.2023.10386586,"Modular Deep Learning for Big Data: Motivation, Challenges, and Approaches",S. Menik; L. Ramaswamy,2023,"Deep learning (DL) technologies have the potential to fundamentally transform many Big Data domains ranging from agriculture and healthcare to transportation and entertainment. However, a large percentage of “non-tech” sectors have been unable to fully harness the power of DL technologies because of the lack of expertise, resources and training data for developing, tuning and managing DL models. The monolithic model paradigm that dominates the current DL landscape has a number of drawbacks that have impeded wider adoption of DL in various Big Data domains. This paper presents an alternate vision, namely modular DL paradigm. Semantically meaningful DL modules form the basic building blocks of this paradigm, and specific DL tasks are accomplished by creating pipelines of these modules. This paper motivates the need for modular DL through a case study that includes an experimental analysis examine the trade-offs between modular and monolithic DL paradigms. We discuss the challenges in designing a modular DL framework for robust and cost-effective Big Data analytics, and outline approaches to address the challenges.",no,The paper discusses a general deep learning paradigm and does not use or produce any specific dataset with Italian national coverage.,
10.1109/MetroAgriFor58484.2023.10424245,An Intelligent Q&A Module for Tea Diseases and Pests Based on Automatic Knowledge Graph Construction,Q. Huang; Y. Tao; S. Ding; Y. Liu; F. Marinello,2023,"Tea pests and diseases are among the primary constraints in the tea industry. However, practitioners often rely on books and the internet for pests and diseases information, leading to fragmented and time-consuming searches. Constructing a question-answering system based on a knowledge graph of tea pests and diseases can address these issues. This study utilizes the deep learning model BERT-BiLSTM-CRF to automatically extract triplets, enabling the automatic construction of the knowledge graph and automated question-answering based on it. This research facilitates the rapid development of a knowledge graph in the agricultural tea sector and provides solutions for the scientific prevention and control of tea pests and diseases.",no,The abstract does not specify that the data source has Italian coverage.,
10.1109/MetroAgriFor58484.2023.10424383,Uncertainty Model for NDVI Estimation from Multispectral Camera Measurements,F. Khalesi; P. Daponte; L. De Vito; F. Picariello; I. Tudosa,2023,"To accurately measure vegetation, soil, and environmental feature parameters in Precision Agriculture (PA), it is important to consider the quantity of uncertainty associated with these measurements. Assessing the uncertainty of vegetation indices provides information regarding the level of confidence of the classification usually done for determining the health status of vegetation. This paper proposes an uncertainty model for the Normalized Difference Vegetation Index (NDVI) estimation, which represents a key indicator used in PA for assessing plant health. The proposed model considers the limited bandwidth of the sensors embedded in a multi-spectral camera and the variability in optical density within their nominal wavelengths, specifically in the Red and Near Infrared bands, during the process of image acquisition. This variability is an uncertainty source in the NDVI measurements. The uncertainty model is applied to a dry and fresh Douglas fir leaves dataset [1]. The obtained uncertainty values fall within the range of 0.03 to 0.09 for both dry and fresh.",no,The dataset used is not specified as having Italian coverage.,
